key,instruction,level_id,sample_id,reward_enum,feature_name,sub_condition,condition_1,condition_2,condition_3,condition_4,condition_5,condition_6
020896,signs in the shape of letters and numbers on a green field,896,pokemon_0126_rot90,3,wall_count,tree+house+fence,,,0.0,,,
020897,line of trees with a notch in the middle with rocks below and flowers,897,pokemon_0127_rot90,3,wall_count,tree+house+fence,,,31.0,,,
020898,a square forest with lines of trees coming out of it,898,pokemon_0128_rot90,3,wall_count,tree+house+fence,,,90.0,,,
020899,"Two circles of trees on a beach by the ocean, with a row of rocks and flowers behind a fence",899,pokemon_0129_rot90,3,wall_count,tree+house+fence,,,46.0,,,
020900,Trees randomly scattered on a empty field,900,pokemon_0130_rot90,3,wall_count,tree+house+fence,,,60.0,,,
020901,"A small house on a grassy island with trees, surrounded by water",901,pokemon_0131_rot90,3,wall_count,tree+house+fence,,,18.0,,,
020902,perfect diagonal lines of trees,902,pokemon_0132_rot90,3,wall_count,tree+house+fence,,,112.0,,,
020903,A wide line of trees above a grassy clearing with flowers,903,pokemon_0133_rot90,3,wall_count,tree+house+fence,,,100.0,,,
020904,"A graveyard surrounded by fences on the right and right, next to an overgrown forest",904,pokemon_0134_rot90,3,wall_count,tree+house+fence,,,77.0,,,
020905,"A empty square grassy clearing, surrounded by a line of trees",905,pokemon_0135_rot90,3,wall_count,tree+house+fence,,,199.0,,,
020906,"A grassy unkept town with four houses, with a road leading to each house",906,pokemon_0136_rot90,3,wall_count,tree+house+fence,,,10.0,,,
020907,"A maze of trees with two openings, and some rocks in the clearings",907,pokemon_0137_rot90,3,wall_count,tree+house+fence,,,125.0,,,
020908,"A rectangle of trees, above the word ""HI"" made out of flowers",908,pokemon_0138_rot90,3,wall_count,tree+house+fence,,,19.0,,,
020909,"A wide road going around a pond surrounded by flowers, above a wide line of trees",909,pokemon_0139_rot90,3,wall_count,tree+house+fence,,,124.0,,,
020910,A gigantic upside-left house,910,pokemon_0140_rot90,3,wall_count,tree+house+fence,,,98.0,,,
020911,Straight lines of trees with grassy roads going between them,911,pokemon_0141_rot90,3,wall_count,tree+house+fence,,,122.0,,,
020912,"A road that takes a sharp turn with trees along it, below the ocean",912,pokemon_0142_rot90,3,wall_count,tree+house+fence,,,6.0,,,
020913,"A neat town with many houses, each house has a tree next to it and a road through the town",913,pokemon_0143_rot90,3,wall_count,tree+house+fence,,,22.0,,,
020914,A wide path through the forest that has a sharp turn,914,pokemon_0144_rot90,3,wall_count,tree+house+fence,,,108.0,,,
020915,A plain path going through a field with some flowers and one cluster of trees,915,pokemon_0145_rot90,3,wall_count,tree+house+fence,,,28.0,,,
020916,"A big pool with a fence on one side, and trees on the corners",916,pokemon_0146_rot90,3,wall_count,tree+house+fence,,,50.0,,,
020917,"A big crazy house in the middle of a scary forest, with a path leading to the front door",917,pokemon_0147_rot90,3,wall_count,tree+house+fence,,,139.0,,,
020918,"A sandy island in the middle of the ocean, with a small house on it",918,pokemon_0148_rot90,3,wall_count,tree+house+fence,,,10.0,,,
020919,A maze of trees with some rocks and flowers,919,pokemon_0149_rot90,3,wall_count,tree+house+fence,,,213.0,,,
020920,An empty clearing blow a dense forest with a path blocked by a rock,920,pokemon_0150_rot90,3,wall_count,tree+house+fence,,,126.0,,,
020921,a small L shaped pond surrounded a flowery forest,921,pokemon_0151_rot90,3,wall_count,tree+house+fence,,,157.0,,,
020922,an S shaped maze of trees,922,pokemon_0152_rot90,3,wall_count,tree+house+fence,,,208.0,,,
020923,"an X shaped river with a tree island, a sand island, a rock island, and a tree island",923,pokemon_0153_rot90,3,wall_count,tree+house+fence,,,58.0,,,
020924,A tree maze with rocks with an entrance at the right and an exit on right,924,pokemon_0154_rot90,3,wall_count,tree+house+fence,,,205.0,,,
020925,A small grassy island with a cluster of trees in the middle of an ocean,925,pokemon_0155_rot90,3,wall_count,tree+house+fence,,,5.0,,,
020926,"A straight road on the right, below a flowery forest with a square lake",926,pokemon_0156_rot90,3,wall_count,tree+house+fence,,,100.0,,,
020927,A blank field with many straight lines of trees,927,pokemon_0157_rot90,3,wall_count,tree+house+fence,,,64.0,,,
020928,A grassy field with some squares of trees,928,pokemon_0158_rot90,3,wall_count,tree+house+fence,,,122.0,,,
020929,"An overgrown tree maze with pokeballs, and a path from the entrance to exit",929,pokemon_0159_rot90,3,wall_count,tree+house+fence,,,198.0,,,
020930,"A grassy road that leads to a fenced off path and an ocean, surrounded by forest",930,pokemon_0160_rot90,3,wall_count,tree+house+fence,,,169.0,,,
020931,A wide straight path through a dense forest,931,pokemon_0161_rot90,3,wall_count,tree+house+fence,,,208.0,,,
020932,A big beach with lots of sand and a fence,932,pokemon_0162_rot90,3,wall_count,tree+house+fence,,,25.0,,,
020933,A house on a creek with a path leading from the door across the creek to the forest,933,pokemon_0163_rot90,3,wall_count,tree+house+fence,,,106.0,,,
020934,A medium sized beach with a fence and a rocky path leading to the beach,934,pokemon_0164_rot90,3,wall_count,tree+house+fence,,,14.0,,,
020935,A straight medium sized river with fences on both sides and warning signs,935,pokemon_0165_rot90,3,wall_count,tree+house+fence,,,148.0,,,
020936,A huge empty square of trees,936,pokemon_0166_rot90,3,wall_count,tree+house+fence,,,187.0,,,
020937,two tall buildings near the forest and a small beach,937,pokemon_0167_rot90,3,wall_count,tree+house+fence,,,111.0,,,
020938,Two houses in a forest with a road leading to both doors,938,pokemon_0168_rot90,3,wall_count,tree+house+fence,,,141.0,,,
020939,A house on a large grassy island with a beach around it,939,pokemon_0169_rot90,3,wall_count,tree+house+fence,,,11.0,,,
020940,A city with skyscrapers on either side of a wide tree lined river,940,pokemon_0170_rot90,3,wall_count,tree+house+fence,,,72.0,,,
020941,A winding beach next to a meadow,941,pokemon_0171_rot90,3,wall_count,tree+house+fence,,,12.0,,,
020942,A big ocean with a fence on it below a field with some clusters of trees and a sign,942,pokemon_0172_rot90,3,wall_count,tree+house+fence,,,38.0,,,
020943,A huge palace with a pool in front of a wide path,943,pokemon_0173_rot90,3,wall_count,tree+house+fence,,,54.0,,,
020944,A small house on a grassy plain next to a wide river,944,pokemon_0174_rot90,3,wall_count,tree+house+fence,,,30.0,,,
020945,"A straight road with many turns, with a river on either side and a cluster of trees in the middle",945,pokemon_0175_rot90,3,wall_count,tree+house+fence,,,15.0,,,
020946,"A wide grassy plain with signs and rocks, and two tiny beaches in the corners",946,pokemon_0176_rot90,3,wall_count,tree+house+fence,,,0.0,,,
020947,A dog made out of water,947,pokemon_0177_rot90,3,wall_count,tree+house+fence,,,12.0,,,
020948,A small town with a few small houses and a road connecting them all,948,pokemon_0178_rot90,3,wall_count,tree+house+fence,,,61.0,,,
020949,"A wide path going diagonally across the map, with two medium sized fences on either side",949,pokemon_0179_rot90,3,wall_count,tree+house+fence,,,28.0,,,
020950,A tree maze with big empty clearings,950,pokemon_0180_rot90,3,wall_count,tree+house+fence,,,136.0,,,
020951,"A river that splits into two rivers, with sandy embankments and a forest between the fork",951,pokemon_0181_rot90,3,wall_count,tree+house+fence,,,47.0,,,
020952,A row of tiny houses in front of a field of scattered pokeballs,952,pokemon_0182_rot90,3,wall_count,tree+house+fence,,,32.0,,,
020953,A path that takes a sharp turn to run along a thin river,953,pokemon_0183_rot90,3,wall_count,tree+house+fence,,,14.0,,,
020954,"A medium sized lake with small beaches, with two small clusters of trees",954,pokemon_0184_rot90,3,wall_count,tree+house+fence,,,12.0,,,
020955,A house with a path next to three rivers going through the forest,955,pokemon_0185_rot90,3,wall_count,tree+house+fence,,,55.0,,,
020956,A mess of signs and trees with some sand,956,pokemon_0186_rot90,3,wall_count,tree+house+fence,,,23.0,,,
020957,A maze of trees and rocks,957,pokemon_0187_rot90,3,wall_count,tree+house+fence,,,114.0,,,
020958,Twisty lines of trees,958,pokemon_0188_rot90,3,wall_count,tree+house+fence,,,72.0,,,
020959,A wide path through a dense forest leading to a small house next to two lakes,959,pokemon_0190_rot90,3,wall_count,tree+house+fence,,,167.0,,,
020960,A wild twisting river with sandy shores going through a messy forest,960,pokemon_0191_rot90,3,wall_count,tree+house+fence,,,96.0,,,
020961,A house surrounded by sand in a forest below another small house,961,pokemon_0192_rot90,3,wall_count,tree+house+fence,,,133.0,,,
020962,a straight path of flowers with a few small clusters of trees,962,pokemon_0193_rot90,3,wall_count,tree+house+fence,,,12.0,,,
020963,A straight path through the forest leading to a straight flat beach,963,pokemon_0194_rot90,3,wall_count,tree+house+fence,,,114.0,,,
020964,A huge beach next to an ocean shaped like a triangle,964,pokemon_0196_rot90,3,wall_count,tree+house+fence,,,35.0,,,
020965,A wide path that curves to the side to avoid a fence,965,pokemon_0197_rot90,3,wall_count,tree+house+fence,,,82.0,,,
020966,A wild and messy river with sandy shores,966,pokemon_0198_rot90,3,wall_count,tree+house+fence,,,20.0,,,
020967,A pipe shape made of trees,967,pokemon_0199_rot90,3,wall_count,tree+house+fence,,,26.0,,,
020968,Two small houses surrounded by sand in a wild forest,968,pokemon_0200_rot90,3,wall_count,tree+house+fence,,,60.0,,,
020969,A cross shaped path below two thin curving rivers,969,pokemon_0201_rot90,3,wall_count,tree+house+fence,,,16.0,,,
020970,three houses in a grid surrounded by a huge fence around the edge,970,pokemon_0202_rot90,3,wall_count,tree+house+fence,,,39.0,,,
020971,A cross shaped river cutting through a dense forest,971,pokemon_0203_rot90,3,wall_count,tree+house+fence,,,234.0,,,
020972,A house on a branching path next to a lake,972,pokemon_0204_rot90,3,wall_count,tree+house+fence,,,36.0,,,
020973,Empty perfect squares of trees with a square of rocks in the middle,973,pokemon_0205_rot90,3,wall_count,tree+house+fence,,,220.0,,,
020974,A winding maze of trees in a grassy forest,974,pokemon_0206_rot90,3,wall_count,tree+house+fence,,,195.0,,,
020975,A wide sloppy path going through a field with trees and a small pond,975,pokemon_0207_rot90,3,wall_count,tree+house+fence,,,133.0,,,
020976,A winding path that branches to go around a small pond next to some clusters of trees,976,pokemon_0208_rot90,3,wall_count,tree+house+fence,,,39.0,,,
020977,A flowery meadow with a small lake and a large lake,977,pokemon_0209_rot90,3,wall_count,tree+house+fence,,,0.0,,,
020978,"A forest with two square clearings, one has a block of rocks",978,pokemon_0210_rot90,3,wall_count,tree+house+fence,,,200.0,,,
020979,A tree hedge with two paths going around and through it,979,pokemon_0211_rot90,3,wall_count,tree+house+fence,,,104.0,,,
020980,Trees in the shape of a W around a clearing,980,pokemon_0213_rot90,3,wall_count,tree+house+fence,,,138.0,,,
020981,"An empty field with some scattered sand, trees, and rocks",981,pokemon_0214_rot90,3,wall_count,tree+house+fence,,,10.0,,,
020982,A face made out of grass and sand with signs for eyes,982,pokemon_0215_rot90,3,wall_count,tree+house+fence,,,4.0,,,
020983,A tree maze with one tree surrounded by flowers,983,pokemon_0216_rot90,3,wall_count,tree+house+fence,,,201.0,,,
020984,"A wide curving grassy path surrounded by trees near a beach, with a small house in the corner",984,pokemon_0217_rot90,3,wall_count,tree+house+fence,,,53.0,,,
020985,Three houses on a wide bridge between two beaches,985,pokemon_0218_rot90,3,wall_count,tree+house+fence,,,9.0,,,
020986,"Two small houses in a town with one tall house, and a pool",986,pokemon_0219_rot90,3,wall_count,tree+house+fence,,,75.0,,,
020987,A grassy tree maze with some rocks,987,pokemon_0220_rot90,3,wall_count,tree+house+fence,,,213.0,,,
020988,A house in a forest with two gardens of flowers,988,pokemon_0221_rot90,3,wall_count,tree+house+fence,,,165.0,,,
020989,A river that flows around rocks with a line of trees next to it,989,pokemon_0222_rot90,3,wall_count,tree+house+fence,,,34.0,,,
020990,"A beach next to the ocean, with a cluster of trees behind a fence",990,pokemon_0223_rot90,3,wall_count,tree+house+fence,,,42.0,,,
020991,A thin river that branches out into three rivers,991,pokemon_0224_rot90,3,wall_count,tree+house+fence,,,12.0,,,
020992,A wide road with a house on it next to a huge river,992,pokemon_0225_rot90,3,wall_count,tree+house+fence,,,46.0,,,
020993,A small dirt path leading to a house on a lake next to a forest,993,pokemon_0226_rot90,3,wall_count,tree+house+fence,,,102.0,,,
020994,An overgrown tree maze,994,pokemon_0227_rot90,3,wall_count,tree+house+fence,,,206.0,,,
020995,A winding river through a dense flowery forest that splits into two,995,pokemon_0229_rot90,3,wall_count,tree+house+fence,,,193.0,,,
020996,A wide sandy beach next to grass leading to a flowery forest,996,pokemon_0230_rot90,3,wall_count,tree+house+fence,,,63.0,,,
020997,A wide path with two sharp turns with a few squares of tree and a fence below a pond,997,pokemon_0231_rot90,3,wall_count,tree+house+fence,,,46.0,,,
020998,"An island in the middle of a wide river, with a square of trees on it",998,pokemon_0232_rot90,3,wall_count,tree+house+fence,,,16.0,,,
020999,Curving lines of trees in a grassy field,999,pokemon_0233_rot90,3,wall_count,tree+house+fence,,,71.0,,,
021000,A circle of trees with grass and sand in the middle,0,pokemon_0000,4,object_count,spawn+water,,,,0.0,,
021001,A island surrounded by water with a beach and some trees and flowers,1,pokemon_0001,4,object_count,spawn+water,,,,208.0,,
021002,A field with some random rocks and lines of trees,2,pokemon_0002,4,object_count,spawn+water,,,,0.0,,
021003,A maze of trees with some rocks blocking the path and tall grass inside,3,pokemon_0003,4,object_count,spawn+water,,,,0.0,,
021004,"A path with clumps of trees on the sides, going between two lakes",4,pokemon_0004,4,object_count,spawn+water,,,,87.0,,
021005,"A branching path surrounded by empty grass, with a small pond in the corner and some trees",5,pokemon_0006,4,object_count,spawn+water,,,,45.0,,
021006,A big island with one tree and a big beach,6,pokemon_0007,4,object_count,spawn+water,,,,157.0,,
021007,"A field with two small ponds, some trees in the corner and a tiny beach, with random pokeballs",7,pokemon_0008,4,object_count,spawn+water,,,,6.0,,
021008,"A winding path going around a long straight fence, with flowers everywhere",8,pokemon_0009,4,object_count,spawn+water,,,,0.0,,
021009,"A small circle of trees, with trees in the corners and the sides",9,pokemon_0010,4,object_count,spawn+water,,,,0.0,,
021010,"Two big squares of trees, with flowers in one and rocks between them",10,pokemon_0011,4,object_count,spawn+water,,,,0.0,,
021011,"A straight line of trees, with a straight line of rocks",11,pokemon_0012,4,object_count,spawn+water,,,,0.0,,
021012,"A field with some clusters of flowers, with a beach and a tiny bit of water in the corner",12,pokemon_0013,4,object_count,spawn+water,,,,20.0,,
021013,"Two blocks of trees, with a small pond and a small patch of sand",13,pokemon_0014,4,object_count,spawn+water,,,,7.0,,
021014,"A path that bends, with a small pond on the side and rows of trees behind a long fence up top",14,pokemon_0016,4,object_count,spawn+water,,,,8.0,,
021015,A circle of trees,15,pokemon_0017,4,object_count,spawn+water,,,,0.0,,
021016,A deep forest maze,16,pokemon_0018,4,object_count,spawn+water,,,,0.0,,
021017,"Island with flowers, trees, and a house in a clearing of a forest",17,pokemon_0019,4,object_count,spawn+water,,,,18.0,,
021018,horizontal lines of tress separating a flower field from a lake,18,pokemon_0020,4,object_count,spawn+water,,,,8.0,,
021019,A beautiful flower clearing in the middle of a deep forest,19,pokemon_0021,4,object_count,spawn+water,,,,0.0,,
021020,A house sitting on the corner of a path on the edge of the sea with patches of trees around,20,pokemon_0022,4,object_count,spawn+water,,,,88.0,,
021021,A spiraling forest with clumps of stones in the corner,21,pokemon_0024,4,object_count,spawn+water,,,,0.0,,
021022,A tree and flower farm with a fence and tree barrier,22,pokemon_0025,4,object_count,spawn+water,,,,0.0,,
021023,The edge of a forest on one side with a rock surrounded by trees in the middle,23,pokemon_0026,4,object_count,spawn+water,,,,0.0,,
021024,winding walls of trees surrounding flower clearings with rocks,24,pokemon_0027,4,object_count,spawn+water,,,,0.0,,
021025,walls of trees creating smaller clearings with rocks and some flowers,25,pokemon_0028,4,object_count,spawn+water,,,,0.0,,
021026,A beautiful oasis in the desert with a small patch of trees and flowers,26,pokemon_0029,4,object_count,spawn+water,,,,11.0,,
021027,A sparse forest with a patch of flowers in the middle and rocks on the edges,27,pokemon_0030,4,object_count,spawn+water,,,,0.0,,
021028,Two rings made of trees with some rocks between them,28,pokemon_0031,4,object_count,spawn+water,,,,0.0,,
021029,The edge of a forest with a clearing with a line of flowers and some rocks,29,pokemon_0032,4,object_count,spawn+water,,,,0.0,,
021030,A sandy river delta with tree groups on either side if the rivers and flowers,30,pokemon_0033,4,object_count,spawn+water,,,,32.0,,
021031,A town with ponds and trees,31,pokemon_0034,4,object_count,spawn+water,,,,13.0,,
021032,A town with two small ponds in the corners,32,pokemon_0035,4,object_count,spawn+water,,,,52.0,,
021033,"a path that makes a sharp turn by a cluster of trees, with a fence beside the path",33,pokemon_0036,4,object_count,spawn+water,,,,0.0,,
021034,"A bunch of random blocks of sand, water, trees, and rocks",34,pokemon_0037,4,object_count,spawn+water,,,,12.0,,
021035,"A square forest, with a spiral path of grass in the center leading to a pokeball",35,pokemon_0038,4,object_count,spawn+water,,,,0.0,,
021036,"A crossroads, with some water along the path and some trees and rocks scattered randomly",36,pokemon_0039,4,object_count,spawn+water,,,,13.0,,
021037,"A long river going through an empty field, with two trees and a long fence at the top",37,pokemon_0040,4,object_count,spawn+water,,,,17.0,,
021038,"A small house with a path in front of it at the bottom, with a fence behind the house and a bunch of trees at the top, with two rivers",38,pokemon_0041,4,object_count,spawn+water,,,,98.0,,
021039,A meadow surrounded by forest in a U shape,39,pokemon_0042,4,object_count,spawn+water,,,,0.0,,
021040,A dense forest,40,pokemon_0043,4,object_count,spawn+water,,,,0.0,,
021041,"A symmetrical forest, the trees form an arrow shape",41,pokemon_0044,4,object_count,spawn+water,,,,0.0,,
021042,"A large building in front of a small forest, with two doors with a path that forks and connects the doors",42,pokemon_0045,4,object_count,spawn+water,,,,27.0,,
021043,"Clusters of trees in the four corners of the map, with a cluster of trees and a rock in the center",43,pokemon_0046,4,object_count,spawn+water,,,,0.0,,
021044,"Some random lines of trees, with rocks scattered between them",44,pokemon_0047,4,object_count,spawn+water,,,,0.0,,
021045,"A small house with a fence in front, in front of a forest with a river in the corner",45,pokemon_0048,4,object_count,spawn+water,,,,24.0,,
021046,"Some lines of trees forming a chair shape, with a cluster of rocks in the corner",46,pokemon_0049,4,object_count,spawn+water,,,,0.0,,
021047,A maze of trees with some flowers and rocks,47,pokemon_0050,4,object_count,spawn+water,,,,0.0,,
021048,A small cluster of rocks in the middle of an empty field beside a lake,48,pokemon_0051,4,object_count,spawn+water,,,,52.0,,
021049,"A house in the corner, next to a river with a bridge across it",49,pokemon_0052,4,object_count,spawn+water,,,,36.0,,
021050,A maze of trees in a square shape,50,pokemon_0053,4,object_count,spawn+water,,,,0.0,,
021051,"A dense forest covering most of the map, with a small lake in the corner",51,pokemon_0054,4,object_count,spawn+water,,,,42.0,,
021052,A maze of trees with big clearings,52,pokemon_0055,4,object_count,spawn+water,,,,0.0,,
021053,"A river that makes a Z shape, with a long straight fence up top and empty grass everywhere else",53,pokemon_0056,4,object_count,spawn+water,,,,17.0,,
021054,"A crazy branching river that splits the map into many pieces, with trees and flowers on the shore of the river",54,pokemon_0057,4,object_count,spawn+water,,,,71.0,,
021055,lines of trees forming a T shape,55,pokemon_0058,4,object_count,spawn+water,,,,0.0,,
021056,"A random mess of trees, sand, rocks, and grass",56,pokemon_0060,4,object_count,spawn+water,,,,12.0,,
021057,"A small, thin pond in the center with a block of trees up top and some random rocks below",57,pokemon_0061,4,object_count,spawn+water,,,,4.0,,
021058,"Two straight fences on the top and bottom, with a line of rocks connecting them and some clusters of trees",58,pokemon_0062,4,object_count,spawn+water,,,,0.0,,
021059,"A castle with a moat and a sand bridge, with a fence and a gate",59,pokemon_0063,4,object_count,spawn+water,,,,70.0,,
021060,"A cluster of trees in the middle of the map, with a snaking river on the side and a fence on the bottom",60,pokemon_0064,4,object_count,spawn+water,,,,45.0,,
021061,"A straight snaking path that goes around a square pond, with some forests on the edges",61,pokemon_0065,4,object_count,spawn+water,,,,4.0,,
021062,"A path with a wide block in the middle, going across a grassy field with a forest in the corner",62,pokemon_0066,4,object_count,spawn+water,,,,0.0,,
021063,"A cross of trees, with a solid block of rocks in one corner and flowers in the opposite corner",63,pokemon_0067,4,object_count,spawn+water,,,,0.0,,
021064,"A grassy path with fields of flowers on the sides, and lines of trees on the edge",64,pokemon_0068,4,object_count,spawn+water,,,,0.0,,
021065,A bunch of trees shaped like a thick cross,65,pokemon_0069,4,object_count,spawn+water,,,,0.0,,
021066,"A grassy spiral maze of trees with a prize at the end, and trees around the edges",66,pokemon_0070,4,object_count,spawn+water,,,,0.0,,
021067,"A grassy forest, with two clusters of trees in the middle and trees around the edges",67,pokemon_0071,4,object_count,spawn+water,,,,0.0,,
021068,Trees in the shape of a person,68,pokemon_0073,4,object_count,spawn+water,,,,0.0,,
021069,"A snaking path with a square of trees in the middle of it, and some fences along the path",69,pokemon_0074,4,object_count,spawn+water,,,,0.0,,
021070,"A grassy field with a small house in one corner, and small beaches in two other corners",70,pokemon_0075,4,object_count,spawn+water,,,,49.0,,
021071,"A winding path going through a fence, with two big lakes in the corners and some trees",71,pokemon_0076,4,object_count,spawn+water,,,,80.0,,
021072,concentric rings of trees radiating from the corner,72,pokemon_0077,4,object_count,spawn+water,,,,0.0,,
021073,"two small clumps of trees in the corners, with a line of flowers running diagonally",73,pokemon_0079,4,object_count,spawn+water,,,,0.0,,
021074,"trees around the border, with two large clearings separated by a line of trees",74,pokemon_0080,4,object_count,spawn+water,,,,0.0,,
021075,a random clump of trees and rocks,75,pokemon_0081,4,object_count,spawn+water,,,,0.0,,
021076,"A medium sized house in the corner, with a branching path running through the middle and a lake with a pokeball in the center in the corner",76,pokemon_0083,4,object_count,spawn+water,,,,42.0,,
021077,"A wide path running from top to bottom, through lines of trees and a fence with flowers all around and a lake",77,pokemon_0084,4,object_count,spawn+water,,,,16.0,,
021078,"a tiny house in the corner, with fields of tall grass separated by fences",78,pokemon_0085,4,object_count,spawn+water,,,,1.0,,
021079,A big forest with a clearing that has a lake and some sand and flowers,79,pokemon_0086,4,object_count,spawn+water,,,,7.0,,
021080,"A grassy field with some flowers, trees, and rocks, and a fence on the bottom",80,pokemon_0087,4,object_count,spawn+water,,,,0.0,,
021081,"Two small houses separated by a grassy field with rocks and some signs, with two beaches in the other corners",81,pokemon_0089,4,object_count,spawn+water,,,,50.0,,
021082,"A line of trees at the top, with some lines and trees and grass below",82,pokemon_0090,4,object_count,spawn+water,,,,6.0,,
021083,"A small house on a lake, with a branching road going from the front door to the top",83,pokemon_0092,4,object_count,spawn+water,,,,11.0,,
021084,"A randomly shaped lake across half the map, with some trees in the lake",84,pokemon_0093,4,object_count,spawn+water,,,,76.0,,
021085,"A big forest that tapers off on the side, with a lake in the middle of the forest",85,pokemon_0094,4,object_count,spawn+water,,,,9.0,,
021086,"A huge block of trees on the top half of the map, with a clearing below it, and one thin line of trees below that",86,pokemon_0095,4,object_count,spawn+water,,,,0.0,,
021087,An amongus made of rocks,87,pokemon_0096,4,object_count,spawn+water,,,,2.0,,
021088,"The top half has a grassy field with a cluster of trees, and the bottom half has a fence next to a straight road and some rocks below",88,pokemon_0097,4,object_count,spawn+water,,,,12.0,,
021089,A grassy maze of trees,89,pokemon_0098,4,object_count,spawn+water,,,,0.0,,
021090,A river curving through a grassy field with a fence on top,90,pokemon_0099,4,object_count,spawn+water,,,,23.0,,
021091,A box of trees with a big cluster of trees and rocks in the middle,91,pokemon_0101,4,object_count,spawn+water,,,,0.0,,
