key,instruction,level_id,sample_id,reward_enum,feature_name,sub_condition,condition_0,condition_1,condition_2,condition_3,condition_4
pk001223,A grassy field that is line with trees,001223,pokemon_0234,1,path_length,,,18.0,,,
pk001224,A town with many houses and a line of rocks blocking the road,001224,pokemon_0236,1,path_length,,,30.0,,,
pk001225,A square pool of water surrounded by rocks with a path leading to it,001225,pokemon_0237,1,path_length,,,25.0,,,
pk001226,A thin path with grass on the side going through a thick forest,001226,pokemon_0238,1,path_length,,,21.0,,,
pk001227,A thin river that snakes through a field with trees lining the shore,001227,pokemon_0239,1,path_length,,,17.0,,,
pk001228,A path that goes straight and hooks into a small house by a grassy forest,001228,pokemon_0240,1,path_length,,,22.0,,,
pk001229,Some lines of trees with rocks scattered in a plain field,001229,pokemon_0241,1,path_length,,,23.0,,,
pk001230,A natural lake with a small beach that is lined with trees and tall grass,001230,pokemon_0242,1,path_length,,,30.0,,,
pk001231,A tree maze with a path of tall grass leading to a pokeball,001231,pokemon_0243,1,path_length,,,16.0,,,
pk001232,A path through a flowery field that forks in two directions,001232,pokemon_0244,1,path_length,,,26.0,,,
pk001233,A path going in three different directions next to an ocean,001233,pokemon_0245,1,path_length,,,29.0,,,
pk001234,An empty field lined on two sides by trees,001234,pokemon_0246,1,path_length,,,21.0,,,
pk001235,"A map thats almost entirely covered in fences, with two signs and a grass path",001235,pokemon_0247,1,path_length,,,30.0,,,
pk001236,A wide path with some small puddles and rocks in the way,001236,pokemon_0248,1,path_length,,,21.0,,,
pk001237,A wide river with sandy beaches next to a small house with a rocky path,001237,pokemon_0249,1,path_length,,,24.0,,,
pk001238,A wide dirt path cutting through a thick forest,001238,pokemon_0250,1,path_length,,,9.0,,,
pk001239,A tree with a big clearing in the shape of an arrow,001239,pokemon_0251,1,path_length,,,15.0,,,
pk001240,An amongus made of fences next to a beach,001240,pokemon_0252,1,path_length,,,24.0,,,
pk001241,A wide river with a few houses and a dirt path across the river,001241,pokemon_0253,1,path_length,,,30.0,,,
pk001242,a forest with yellow flowers,001242,pokemon_0255,1,path_length,,,20.0,,,
pk001243,A huge ocean with a path of trees going halfway through and a thick fence,001243,pokemon_0256,1,path_length,,,21.0,,,
pk001244,A tree maze that leads to a wide house with a lake in the corner,001244,pokemon_0257,1,path_length,,,36.0,,,
pk001245,A forest with flowers and grass,001245,pokemon_0258,1,path_length,,,8.0,,,
pk001246,A clearing lined with trees with some lines of trees cutting through the grass,001246,pokemon_0259,1,path_length,,,21.0,,,
pk001247,A diagonal path of grass with a cluster of trees in the middle leading to a lake,001247,pokemon_0260,1,path_length,,,23.0,,,
pk001248,A wide path with a sharp turn in the middle next to a flowery meadow,001248,pokemon_0261,1,path_length,,,31.0,,,
pk001249,A thin path below a thin bent river and a strange house,001249,pokemon_0262,1,path_length,,,24.0,,,
pk001250,An empty field with a zig zag dirt path,001250,pokemon_0263,1,path_length,,,30.0,,,
pk001251,An oasis in the middle of a field with some flowers,001251,pokemon_0264,1,path_length,,,30.0,,,
pk001252,Vertical and horizontal lines of trees with small squares of water and rocks,001252,pokemon_0265,1,path_length,,,31.0,,,
pk001253,Vertical and horizontal lines of trees forming a forest clearing with rocks and flowers,001253,pokemon_0266,1,path_length,,,27.0,,,
pk001254,A symmetric forest with lines of trees breaking the area into 4 parts with rocks and flowers in each area,001254,pokemon_0267,1,path_length,,,11.0,,,
pk001255,A town with paths between houses and a patch of trees in the corner,001255,pokemon_0268,1,path_length,,,24.0,,,
pk001256,A river running through a dense forest,001256,pokemon_0270,1,path_length,,,7.0,,,
pk001257,Clearings in a forest with rocks and flowers,001257,pokemon_0271,1,path_length,,,18.0,,,
pk001258,Horizontal and vertical lines of trees with rocks placed throughout the area,001258,pokemon_0272,1,path_length,,,35.0,,,
pk001259,A house on an island with flowers in the middle of a lake in a forest,001259,pokemon_0273,1,path_length,,,13.0,,,
pk001260,Horizontal lines of fences with gaps in the middle with trees and rocks,001260,pokemon_0274,1,path_length,,,31.0,,,
pk001261,An upside-down triangle of trees in a flower field,001261,pokemon_0275,1,path_length,,,18.0,,,
pk001262,A maze made of trees with rocks,001262,pokemon_0276,1,path_length,,,25.0,,,
pk001263,A house with a mailbox by the beach on the sea in the corner,001263,pokemon_0277,1,path_length,,,33.0,,,
pk001264,A circle of trees with flowers on the outsides of it,001264,pokemon_0278,1,path_length,,,22.0,,,
pk001265,A diverging path leading to the beach with a small park in the middle of the path,001265,pokemon_0279,1,path_length,,,15.0,,,
pk001266,A house surrounded by trees with a mailbox and a flower field in front,001266,pokemon_0280,1,path_length,,,30.0,,,
pk001267,An island in the middle of sea with a single tree,001267,pokemon_0281,1,path_length,,,11.0,,,
pk001268,A house and a mailbox in the middle of horizontal lines of fences with trees on top and bottom,001268,pokemon_0282,1,path_length,,,30.0,,,
pk001269,Square made of rocks with flowers in the middle layers,001269,pokemon_0283,1,path_length,,,30.0,,,
pk001270,A bean shape made of trees,001270,pokemon_0284,1,path_length,,,34.0,,,
pk001271,A path through a river leading through some trees to a horizontal line of fence,001271,pokemon_0286,1,path_length,,,30.0,,,
pk001272,Some mailboxes in a sandpit,001272,pokemon_0287,1,path_length,,,30.0,,,
pk001273,Three lines of trees with a clearing of flowers below and some rocks above,001273,pokemon_0288,1,path_length,,,37.0,,,
pk001274,Some horizontal and vertical lines of trees with rocks in the middle,001274,pokemon_0289,1,path_length,,,17.0,,,
pk001275,A river running through the area with some patches of trees on the river bank,001275,pokemon_0292,1,path_length,,,20.0,,,
pk001276,Some buildings in a town with fences around,001276,pokemon_0293,1,path_length,,,31.0,,,
pk001277,A lake near the top of a field,001277,pokemon_0294,1,path_length,,,31.0,,,
pk001278,A path leading to a house on a peninsula with a mailbox separated by a fence,001278,pokemon_0295,1,path_length,,,11.0,,,
pk001279,A path leading to a mailbox in a field,001279,pokemon_0296,1,path_length,,,30.0,,,
pk001280,A house by a lake with a forest in the corner and some flowers around,001280,pokemon_0297,1,path_length,,,31.0,,,
pk001281,Some lines of trees creating clearings in a forest with rocks,001281,pokemon_0298,1,path_length,,,22.0,,,
pk001282,A clearing with rocks and flowers surrounded by trees,001282,pokemon_0299,1,path_length,,,14.0,,,
pk001283,"Some puddles, rocks, and flowers with a line of trees of two of the sides of the area",001283,pokemon_0300,1,path_length,,,26.0,,,
pk001284,A maze of trees with a clearing for four rocks in the middle,001284,pokemon_0301,1,path_length,,,17.0,,,
pk001285,A vertical path leading to a fence with a mailbox and patches of trees above the fence,001285,pokemon_0302,1,path_length,,,26.0,,,
pk001286,A house with a tree on a desert island,001286,pokemon_0303,1,path_length,,,17.0,,,
pk001287,An area filled with rocks with trees on two of the sides,001287,pokemon_0304,1,path_length,,,22.0,,,
pk001288,A building on an island in the middle of a lake with two other islands in the two top corners,001288,pokemon_0305,1,path_length,,,11.0,,,
pk001289,Pairs of rocks in a field with trees all around the edges,001289,pokemon_0306,1,path_length,,,14.0,,,
pk001290,A town with a path above a lake and a flower field with a fence separating the two,001290,pokemon_0307,1,path_length,,,33.0,,,
pk001291,Six houses on a straight with water above and below,001291,pokemon_0308,1,path_length,,,30.0,,,
pk001292,"Two paths, one leading to a house and one leading to a lake with flowers besides it and a forest behind the lake",001292,pokemon_0309,1,path_length,,,30.0,,,
pk001293,A house with flower fields in front of it and a forest behind it on a the beach,001293,pokemon_0310,1,path_length,,,21.0,,,
pk001294,A building on the left side with a river in the middle and a path leading to a house on the right,001294,pokemon_0311,1,path_length,,,21.0,,,
pk001295,A circular island with rocks surrounding trees on it in the middle of a field with flowers,001295,pokemon_0312,1,path_length,,,31.0,,,
pk001296,A path through a field with a lake underneath it and trees above it,001296,pokemon_0313,1,path_length,,,30.0,,,
pk001297,Lines of trees separating the area into quadrants,001297,pokemon_0314,1,path_length,,,16.0,,,
pk001298,Trees separating the area into three equal parts each with one rock,001298,pokemon_0315,1,path_length,,,9.0,,,
pk001299,A house on the left with a river in the middle and a house on the right with trees all throughout,001299,pokemon_0316,1,path_length,,,19.0,,,
pk001300,Four patches of trees in a flower field,001300,pokemon_0317,1,path_length,,,30.0,,,
pk001301,A path through a light forest,001301,pokemon_0318,1,path_length,,,13.0,,,
pk001302,Four trees in a triangle in the middle of an empty field,001302,pokemon_0319,1,path_length,,,30.0,,,
pk001303,Lake in the middle of a field with a path on one side and trees surrounding it,001303,pokemon_0320,1,path_length,,,23.0,,,
pk001304,A winding path through a forest leading to flowers,001304,pokemon_0321,1,path_length,,,25.0,,,
pk001305,Lines of fences with trees all around and a lake in the bottom corner,001305,pokemon_0322,1,path_length,,,14.0,,,
pk001306,A forest with rocks,001306,pokemon_0323,1,path_length,,,22.0,,,
pk001307,A forest clearing with a few rocks,001307,pokemon_0324,1,path_length,,,9.0,,,
pk001308,A town with trees with a lake in the corner,001308,pokemon_0325,1,path_length,,,32.0,,,
pk001309,A clearing with lines of trees at the bottom and some rocks,001309,pokemon_0326,1,path_length,,,24.0,,,
pk001310,Trees in the shape of the letter A with lines of trees on the side,001310,pokemon_0327,1,path_length,,,14.0,,,
pk001311,Some trees in some sand with fences,001311,pokemon_0328,1,path_length,,,34.0,,,
pk001312,A corner filled with trees and a rock,001312,pokemon_0329,1,path_length,,,30.0,,,
pk001313,A clearing in a forest with flowers and a puddle with trees on the top and bottom,001313,pokemon_0330,1,path_length,,,16.0,,,
pk001314,Some fences randomly in a field,001314,pokemon_0331,1,path_length,,,30.0,,,
pk001315,Forest with some rocks,001315,pokemon_0333,1,path_length,,,21.0,,,
pk001316,"Neighborhood with lake, trees and fences",001316,pokemon_0334,1,path_length,,,26.0,,,
pk001317,Cross river,001317,pokemon_0335,1,path_length,,,22.0,,,
pk001318,Evergreen Enclave,001318,pokemon_0336,1,path_length,,,11.0,,,
pk001319,Serenity Stream,001319,pokemon_0337,1,path_length,,,8.0,,,
pk001320,Two Tree Tundra,001320,pokemon_0338,1,path_length,,,29.0,,,
pk001321,Gale Wind Plains,001321,pokemon_0339,1,path_length,,,26.0,,,
pk001322,Forrest of Judgement,001322,pokemon_0340,1,path_length,,,19.0,,,
pk001323,Waterway Crossing,001323,pokemon_0341,1,path_length,,,10.0,,,
pk001324,Modest Meadow,001324,pokemon_0342,1,path_length,,,30.0,,,
pk001325,Beginners Walkway,001325,pokemon_0343,1,path_length,,,26.0,,,
pk001326,Lake town gateway,001326,pokemon_0344,1,path_length,,,19.0,,,
pk001327,Beach Inn,001327,pokemon_0345,1,path_length,,,26.0,,,
pk001328,Lonely Woods,001328,pokemon_0346,1,path_length,,,21.0,,,
pk001329,Trekkers Trail,001329,pokemon_0347,1,path_length,,,27.0,,,
pk001330,Ridged Path,001330,pokemon_0348,1,path_length,,,30.0,,,
pk001331,Stone Lake shore,001331,pokemon_0349,1,path_length,,,29.0,,,
pk001332,Origin Forrest,001332,pokemon_0350,1,path_length,,,14.0,,,
pk001333,Hidden Brush,001333,pokemon_0351,1,path_length,,,39.0,,,
pk001334,Far Field Ruins,001334,pokemon_0352,1,path_length,,,30.0,,,
pk001335,Calm Cove,001335,pokemon_0353,1,path_length,,,23.0,,,
pk001336,Infinite Corridor,001336,pokemon_0354,1,path_length,,,18.0,,,
pk001337,Passerby Inn,001337,pokemon_0355,1,path_length,,,18.0,,,
pk001338,Humble Homes,001338,pokemon_0356,1,path_length,,,15.0,,,
pk001339,Forrest Crossing,001339,pokemon_0357,1,path_length,,,20.0,,,
pk001340,Inland island,001340,pokemon_0359,1,path_length,,,13.0,,,
pk001341,Waterway walk,001341,pokemon_0360,1,path_length,,,30.0,,,
pk001342,Route 101,001342,pokemon_0361,1,path_length,,,27.0,,,
pk001343,Lone Oak Island,001343,pokemon_0362,1,path_length,,,12.0,,,
pk001344,Man in the ground,001344,pokemon_0363,1,path_length,,,30.0,,,
pk001345,Low Left Lumber,001345,pokemon_0364,1,path_length,,,30.0,,,
pk001346,Burgundy Bridge,001346,pokemon_0365,1,path_length,,,22.0,,,
pk001347,Offshore Pines,001347,pokemon_0366,1,path_length,,,24.0,,,
pk001348,Lost Forrest,001348,pokemon_0367,1,path_length,,,20.0,,,
pk001349,Route 234,001349,pokemon_0368,1,path_length,,,25.0,,,
pk001350,"A forest with scattered stones, a path between the trees",001350,pokemon_0369,1,path_length,,,33.0,,,
pk001351,A square clearing in the forest,001351,pokemon_0370,1,path_length,,,16.0,,,
pk001352,Several horizontal hedges with openings,001352,pokemon_0371,1,path_length,,,47.0,,,
pk001353,Green field with trees,001353,pokemon_0372,1,path_length,,,30.0,,,
pk001354,Forest around rocks,001354,pokemon_0373,1,path_length,,,11.0,,,
pk001355,Houses in the coast with trees,001355,pokemon_0374,1,path_length,,,15.0,,,
pk001356,Trees in field with river,001356,pokemon_0375,1,path_length,,,21.0,,,
pk001357,River with trees and path,001357,pokemon_0376,1,path_length,,,22.0,,,
pk001358,House in the forest,001358,pokemon_0377,1,path_length,,,15.0,,,
pk001359,Dirt in field with trees,001359,pokemon_0378,1,path_length,,,25.0,,,
pk001360,Plants in a field with trees,001360,pokemon_0379,1,path_length,,,31.0,,,
pk001361,Trees in field with rocks and plants,001361,pokemon_0380,1,path_length,,,18.0,,,
pk001362,A fenced dirt trail with a forest below it,001362,pokemon_0381,1,path_length,,,40.0,,,
pk001363,a enclosed forest with 4 rocks and a secret area blocked off by another rock with flowers on the edge,001363,pokemon_0382,1,path_length,,,22.0,,,
pk001364,5 houses in a beach neighborhood,001364,pokemon_0383,1,path_length,,,30.0,,,
pk001365,A river leading to a wide path in a cross shape,001365,pokemon_0384,1,path_length,,,29.0,,,
pk001366,Two rocks in a field,001366,pokemon_0385,1,path_length,,,30.0,,,
pk001367,Random trees and rocks,001367,pokemon_0386,1,path_length,,,25.0,,,
pk001368,"A straight path with a house on it, bordered by trees",001368,pokemon_0387,1,path_length,,,20.0,,,
pk001369,A wide path that takes a sharp turn,001369,pokemon_0388,1,path_length,,,21.0,,,
pk001370,A winding path going around clusters of trees,001370,pokemon_0389,1,path_length,,,25.0,,,
pk001371,A duck made out of sand,001371,pokemon_0390,1,path_length,,,21.0,,,
pk001372,Some trees and rocks on the bank of a river,001372,pokemon_0392,1,path_length,,,25.0,,,
pk001373,A tower on the beach,001373,pokemon_0393,1,path_length,,,24.0,,,
pk001374,"A house on a path, with big flower beds next to the path",001374,pokemon_0394,1,path_length,,,31.0,,,
pk001375,A diagonal river with trees on the bank,001375,pokemon_0395,1,path_length,,,18.0,,,
pk001376,A triangle of trees with water inside,001376,pokemon_0396,1,path_length,,,23.0,,,
pk001377,Sandy island in the ocean with two trees,001377,pokemon_0397,1,path_length,,,8.0,,,
pk001378,"Field of tall grass with some pokeballs in it, and a path going through the middle",001378,pokemon_0398,1,path_length,,,29.0,,,
pk001379,Very long house on a flower lined road with a fence,001379,pokemon_0399,1,path_length,,,30.0,,,
pk001380,Big rocky beach,001380,pokemon_0400,1,path_length,,,25.0,,,
pk001381,a house by the beach and a forest,001381,pokemon_0401,1,path_length,,,23.0,,,
pk001382,3 towers on a road,001382,pokemon_0402,1,path_length,,,35.0,,,
pk001383,A house inside of a ring of red flowers inside of a ring of yellow flowers,001383,pokemon_0403,1,path_length,,,30.0,,,
pk001384,A vegetable garden separated by fences,001384,pokemon_0405,1,path_length,,,34.0,,,
pk001385,A crossroads in the shape of a cross,001385,pokemon_0406,1,path_length,,,30.0,,,
pk001386,A road snaking around clusters of rocks,001386,pokemon_0407,1,path_length,,,30.0,,,
pk001387,1 pokeball in a flowery meadow surrounded by trees,001387,pokemon_0408,1,path_length,,,12.0,,,
pk001388,A river coming out of a stone mountain with some trees,001388,pokemon_0409,1,path_length,,,31.0,,,
pk001389,A pokeball surrounded by stone and a water moat,001389,pokemon_0410,1,path_length,,,21.0,,,
pk001390,Two tiny sheds on a beach by a huge body of water,001390,pokemon_0411,1,path_length,,,32.0,,,
pk001391,A stone path going through a flowery field,001391,pokemon_0412,1,path_length,,,30.0,,,
pk001392,A house with a fence and mailbox with a road leading to it,001392,pokemon_0413,1,path_length,,,30.0,,,
pk001393,"A path that makes a sharp turn at a red flower garden, with trees above and to the left",001393,pokemon_0414,1,path_length,,,17.0,,,
pk001394,A wide river separating a field of yellow flowers from a field of red flowers,001394,pokemon_0415,1,path_length,,,19.0,,,
pk001395,a house near a forest and two stones,001395,pokemon_0416,1,path_length,,,33.0,,,
pk001396,Miltank pen but all the miltank escaped,001396,pokemon_0417,1,path_length,,,30.0,,,
pk001397,Little Mushroom House,001397,pokemon_0418,1,path_length,,,40.0,,,
pk001398,Lake houses on the edge of a town,001398,pokemon_0419,1,path_length,,,17.0,,,
pk001399,Ugly Village,001399,pokemon_0420,1,path_length,,,34.0,,,
pk001400,A little neighborhood with unkept grass,001400,pokemon_0421,1,path_length,,,30.0,,,
pk001401,A hut in the sand between two rivers,001401,pokemon_0422,1,path_length,,,16.0,,,
pk001402,A pyramid with a flower lined path leading to the front door,001402,pokemon_0423,1,path_length,,,27.0,,,
pk001403,"A big garden inside of a fence with a bunch of weeds, above a path that takes a turn",001403,pokemon_0424,1,path_length,,,30.0,,,
pk001404,A path of flowers cutting through a forest,001404,pokemon_0425,1,path_length,,,15.0,,,
pk001405,A river in the shape of a penis,001405,pokemon_0427,1,path_length,,,39.0,,,
pk001406,A maze of fences with hidden pokeballs,001406,pokemon_0428,1,path_length,,,30.0,,,
pk001407,A house with a big roof on a peninsula in the ocean,001407,pokemon_0429,1,path_length,,,18.0,,,
pk001408,A fenced in park in the forest with two tables,001408,pokemon_0430,1,path_length,,,13.0,,,
pk001409,Three tall towers connected by a sand road,001409,pokemon_0431,1,path_length,,,30.0,,,
pk001410,A river with rocks on the riverbank and flowers in a field,001410,pokemon_0432,1,path_length,,,25.0,,,
pk001411,A house by the beach in a forest,001411,pokemon_0433,1,path_length,,,20.0,,,
pk001412,A path through the woods with an item in the tall grass,001412,pokemon_0434,1,path_length,,,20.0,,,
pk001413,A town with three houses,001413,pokemon_0435,1,path_length,,,30.0,,,
pk001414,Desert area with items hidden behind rocks,001414,pokemon_0436,1,path_length,,,30.0,,,
pk001415,"A wide road with trees in the middle, leading to three houses",001415,pokemon_0437,1,path_length,,,47.0,,,
pk001416,A forest clearing with weeds and patches of red and yellow flowers,001416,pokemon_0438,1,path_length,,,24.0,,,
pk001417,A yellow flowers garden and red flower garden above a stone path above a river,001417,pokemon_0439,1,path_length,,,25.0,,,
pk001418,A pond with reeds in the center of a small village,001418,pokemon_0440,1,path_length,,,30.0,,,
pk001419,"A path going along a forest, with a path coming off of it that leads to a house with pokeballs behind it",001419,pokemon_0441,1,path_length,,,24.0,,,
pk001420,"Four small ponds with flowers and reeds on the shores, with rocks scattered around",001420,pokemon_0442,1,path_length,,,30.0,,,
pk001421,"A huge lake with a island of stones in the center, and sand on the shore of the lake",001421,pokemon_0443,1,path_length,,,23.0,,,
pk001422,Thick vertical lines of trees,001422,pokemon_0444,1,path_length,,,18.0,,,
pk001423,A path enclosed by fences on the top and bottom,001423,pokemon_0445,1,path_length,,,49.0,,,
pk001424,"An island surrounded by water with some trees, a beach, a rock, flowers, and an item",001424,pokemon_0446,1,path_length,,,7.0,,,
pk001425,A square river around a square of sand,001425,pokemon_0447,1,path_length,,,30.0,,,
pk001426,A patch of sand surrounded by forest,001426,pokemon_0449,1,path_length,,,14.0,,,
pk001427,A village with two houses along a fenced off river,001427,pokemon_0450,1,path_length,,,23.0,,,
pk001428,A bunch of little houses around a sandy town square,001428,pokemon_0451,1,path_length,,,30.0,,,
pk001429,A big pond with two rivers shooting off,001429,pokemon_0452,1,path_length,,,21.0,,,
pk001430,Simple fenced off road from left to right,001430,pokemon_0453,1,path_length,,,30.0,,,
pk001431,House in the woods,001431,pokemon_0454,1,path_length,,,30.0,,,
pk001432,Apartment building,001432,pokemon_0455,1,path_length,,,30.0,,,
pk001433,House with fence and rocks,001433,pokemon_0457,1,path_length,,,30.0,,,
pk001434,Pokeball in field,001434,pokemon_0458,1,path_length,,,30.0,,,
pk001435,River in forest,001435,pokemon_0459,1,path_length,,,23.0,,,
pk001436,Pebble beach with rocks and water,001436,pokemon_0460,1,path_length,,,22.0,,,
pk001437,Flower lined road to a house,001437,pokemon_0462,1,path_length,,,30.0,,,
pk001438,rocky beach,001438,pokemon_0463,1,path_length,,,23.0,,,
pk001439,Island with rocks and trees and a beach,001439,pokemon_0464,1,path_length,,,13.0,,,
pk001440,Forest clearing with shrubs and rocks,001440,pokemon_0465,1,path_length,,,17.0,,,
pk001441,Rocky cliffs,001441,pokemon_0466,1,path_length,,,29.0,,,
pk001442,Coastal road with flowers,001442,pokemon_0467,1,path_length,,,25.0,,,
pk001443,Fenced trees,001443,pokemon_0468,1,path_length,,,30.0,,,
pk001444,Forest path,001444,pokemon_0469,1,path_length,,,17.0,,,
pk001445,House on an island,001445,pokemon_0470,1,path_length,,,9.0,,,
pk001446,Floral Meadow,001446,pokemon_0471,1,path_length,,,30.0,,,
pk001447,Forrest Path,001447,pokemon_0472,1,path_length,,,18.0,,,
pk001448,Forrest Lake,001448,pokemon_0473,1,path_length,,,12.0,,,
pk001449,Triangle shaped lake with a house above it,001449,pokemon_0474,1,path_length,,,28.0,,,
pk001450,Path through a scary forest,001450,pokemon_0475,1,path_length,,,18.0,,,
pk001451,Overgrown winding path leading to a mountain cave,001451,pokemon_0476,1,path_length,,,30.0,,,
pk001452,"X shaped river with a house above and a house below, and sandy river banks on either side",001452,pokemon_0477,1,path_length,,,10.0,,,
pk001453,A path going around small squares of trees,001453,pokemon_0478,1,path_length,,,32.0,,,
pk001454,A bunch of flowers in a clearing surrounded by rocks,001454,pokemon_0479,1,path_length,,,30.0,,,
pk001455,Beach house with pokeballs nearby,001455,pokemon_0480,1,path_length,,,27.0,,,
pk001456,Forest surrounded by flowers,001456,pokemon_0481,1,path_length,,,30.0,,,
pk001457,Labyrinth of walls,001457,pokemon_0482,1,path_length,,,35.0,,,
pk001458,Door leading into surrounded fenced area surrounded by a single layer of flowers,001458,pokemon_0483,1,path_length,,,41.0,,,
pk001459,Zigzagging trees on the top and bottom and in the middle is a bowl of food,001459,pokemon_0484,1,path_length,,,20.0,,,
pk001460,Beach with ocean and sand on the bottom left corner with woods on the right,001460,pokemon_0485,1,path_length,,,24.0,,,
pk001461,A horizontal path on the bottom and two parallel red tile paths above,001461,pokemon_0486,1,path_length,,,30.0,,,
pk001462,Diagonal body of water next to parallel line of woods and a few flowers,001462,pokemon_0487,1,path_length,,,30.0,,,
pk001463,Pokeball guarded by door and surrounded by lake,001463,pokemon_0488,1,path_length,,,30.0,,,
pk001464,Two parallel vertical paths each with trees lined along,001464,pokemon_0489,1,path_length,,,23.0,,,
pk001465,Pokeball in middle of water,001465,pokemon_0490,1,path_length,,,30.0,,,
pk001466,Safari zone,001466,pokemon_0491,1,path_length,,,30.0,,,
pk001467,Open terrain,001467,pokemon_0492,1,path_length,,,25.0,,,
pk001468,Pokeball home,001468,pokemon_0494,1,path_length,,,26.0,,,
pk001469,An oasis with trees and flowers in a desert,001469,pokemon_0495,1,path_length,,,49.0,,,
pk001470,Grave in desert,001470,pokemon_0496,1,path_length,,,30.0,,,
pk001471,A two with two buildings and flower patches,001471,pokemon_0497,1,path_length,,,25.0,,,
pk001472,A clearing in a forest with patches of rocks and a large area of flowers in the middle,001472,pokemon_0498,1,path_length,,,11.0,,,
pk001473,A house with a flower field next to it,001473,pokemon_0499,1,path_length,,,35.0,,,
pk001474,House with trees behind it and two rocks in front,001474,pokemon_0500,1,path_length,,,30.0,,,
pk001475,A fishing hut by a lake with flowers around,001475,pokemon_0501,1,path_length,,,38.0,,,
pk001476,A large flower field with a pokeball in the center,001476,pokemon_0502,1,path_length,,,24.0,,,
pk001477,Trees in the shape of a heart,001477,pokemon_0503,1,path_length,,,24.0,,,
pk001478,An aqueduct with a river running through it above a forest,001478,pokemon_0504,1,path_length,,,4.0,,,
pk001479,A house at the edge of a sea cliff,001479,pokemon_0505,1,path_length,,,21.0,,,
pk001480,"A duck's face made of fences, rocks, and a roof",001480,pokemon_0506,1,path_length,,,30.0,,,
pk001481,Graveyard behind a fence— the tombstones have flowers or offerings in front of them,001481,pokemon_0507,1,path_length,,,30.0,,,
pk001482,Horizontal land bridge over water,001482,pokemon_0508,1,path_length,,,18.0,,,
pk001483,A town by the sea with 4 houses,001483,pokemon_0509,1,path_length,,,35.0,,,
