key,instruction,level_id,sample_id,reward_enum,feature_name,sub_condition,condition_1,condition_2,condition_3,condition_4,condition_5,condition_6
019550,A gravel path through a forest that leads to a flower patch nestled behind a fence. There is a pokemon ball hidden behind tall grass.,550,pokemon_0603,2,path_length,,,25.0,,,,
019551,A house in a forest near a lake,551,pokemon_0604,2,path_length,,,13.0,,,,
019552,Island with two houses,552,pokemon_0605,2,path_length,,,10.0,,,,
019553,a city skyline viewed from a tall height at eye level. there is blue sky and clouds,553,pokemon_0606,2,path_length,,,27.0,,,,
019554,A forest with fences and a pokeball,554,pokemon_0607,2,path_length,,,30.0,,,,
019555,This little house is the last stop before crossing the desert.,555,pokemon_0609,2,path_length,,,24.0,,,,
019556,a very normal forest,556,pokemon_0611,2,path_length,,,39.0,,,,
019557,a small house and a small simple graveyard overlook a frozen lake,557,pokemon_0612,2,path_length,,,24.0,,,,
019558,A favela,558,pokemon_0613,2,path_length,,,30.0,,,,
019559,An oasis in a desert with a tree,559,pokemon_0614,2,path_length,,,30.0,,,,
019560,A dense favela,560,pokemon_0615,2,path_length,,,30.0,,,,
019561,A grave facing a beach with a forest behind,561,pokemon_0619,2,path_length,,,15.0,,,,
019562,A path leading to the entrance of a castle surrounded by a moat.,562,pokemon_0621,2,path_length,,,21.0,,,,
019563,A path leading through a fence into a flower garden.,563,pokemon_0622,2,path_length,,,30.0,,,,
019564,A tree-lined path through a wooded area.,564,pokemon_0623,2,path_length,,,27.0,,,,
019565,"A waterfront warf. Behind it is a field with flowers and patches of sand. Further back are trees, a pond and part of a fence.",565,pokemon_0624,2,path_length,,,26.0,,,,
019566,A woodland chapel with a cemetary and a pond.,566,pokemon_0625,2,path_length,,,30.0,,,,
019567,"A tree-lined neighborhood with four houses, and a path leading to each house.",567,pokemon_0626,2,path_length,,,22.0,,,,
019568,An island surrounded by water. On the island are terraced beaches and a small house.,568,pokemon_0627,2,path_length,,,11.0,,,,
019569,"A path going through a forest, over a river, to a field of flowers.",569,pokemon_0628,2,path_length,,,30.0,,,,
019570,lakeside retreat,570,pokemon_0629,2,path_length,,,24.0,,,,
019571,some fences,571,pokemon_0630,2,path_length,,,30.0,,,,
019572,A little village in the woods,572,pokemon_0635,2,path_length,,,30.0,,,,
019573,A heart-shaped lake surrounded by flowers,573,pokemon_0636,2,path_length,,,30.0,,,,
019574,A lonely cabin the woods,574,pokemon_0637,2,path_length,,,15.0,,,,
019575,A spooky maze in the woods,575,pokemon_0638,2,path_length,,,20.0,,,,
019576,"A meaningless, random mess. A terrible map.",576,pokemon_0639,2,path_length,,,30.0,,,,
019577,"A quaint, sleepy village with a winding path and four houses",577,pokemon_0640,2,path_length,,,30.0,,,,
019578,"A towering lighthouse on a small, sandy island in the ocean.",578,pokemon_0641,2,path_length,,,8.0,,,,
019579,A smiling face,579,pokemon_0642,2,path_length,,,30.0,,,,
019580,"The word ""Cock""",580,pokemon_0643,2,path_length,,,30.0,,,,
019581,Off grid house with river in front,581,pokemon_0644,2,path_length,,,35.0,,,,
019582,Row houses,582,pokemon_0645,2,path_length,,,30.0,,,,
019583,An uninhabited island,583,pokemon_0646,2,path_length,,,16.0,,,,
019584,A thick forest.,584,pokemon_0648,2,path_length,,,6.0,,,,
019585,A straight north-south road along a forest and a coastline.,585,pokemon_0649,2,path_length,,,21.0,,,,
019586,Forrest road to a cemetery,586,pokemon_0650,2,path_length,,,26.0,,,,
019587,Race track,587,pokemon_0651,2,path_length,,,30.0,,,,
019588,3 small lakes in a forrest,588,pokemon_0652,2,path_length,,,12.0,,,,
019589,Windy road to a house in the forrest,589,pokemon_0653,2,path_length,,,42.0,,,,
019590,A big open field with a forrest and 2 small lakes,590,pokemon_0655,2,path_length,,,31.0,,,,
019591,Green fields surrounded by trees,591,pokemon_0656,2,path_length,,,12.0,,,,
019592,2 small forrests and a row og rocks,592,pokemon_0657,2,path_length,,,30.0,,,,
019593,Small island with a forrest and a beach off the coast,593,pokemon_0658,2,path_length,,,15.0,,,,
019594,Beach with a swamp behind,594,pokemon_0659,2,path_length,,,20.0,,,,
019595,Water and green fields,595,pokemon_0660,2,path_length,,,20.0,,,,
019596,A upside down T shaped lake and a few trees,596,pokemon_0661,2,path_length,,,24.0,,,,
019597,A forrest with green fields,597,pokemon_0662,2,path_length,,,19.0,,,,
019598,An arranged forrest,598,pokemon_0663,2,path_length,,,22.0,,,,
019599,A row house with gardens in front and with ocean view,599,pokemon_0664,2,path_length,,,25.0,,,,
019600,A large manor house,600,pokemon_0665,2,path_length,,,25.0,,,,
019601,A forest with trees covering the border. A continuous turning line of trees in the middle. A few rocks scattered around.,601,pokemon_0666,2,path_length,,,14.0,,,,
019602,"A road surrounded by fence, surrounded by trees.",602,pokemon_0667,2,path_length,,,18.0,,,,
019603,A yard with a house. A road leading up to the house. The yard is surrounded by trees and a fence to the south.,603,pokemon_0668,2,path_length,,,17.0,,,,
019604,A path through plains with partial fence next to a grove and some water.,604,pokemon_0669,2,path_length,,,25.0,,,,
019605,A thick diagonal strip of land surrounded by water. Some sand and rocks scattered around.,605,pokemon_0670,2,path_length,,,30.0,,,,
019606,A beach with water to the north. A grove of trees and grass with fence at the bottom.,606,pokemon_0671,2,path_length,,,24.0,,,,
019607,A path going from bottom to top splitting in two. Groves of trees scattered throughout. Body of water to the south west. Some rocks and flowers.,607,pokemon_0672,2,path_length,,,25.0,,,,
019608,Horizontal rows of trees.,608,pokemon_0673,2,path_length,,,30.0,,,,
019609,A diagonal cross of water with many boxes throughout.,609,pokemon_0674,2,path_length,,,10.0,,,,
019610,A beach with a group of trees. Flowers on grass. A fence with an opening to at the bottom.,610,pokemon_0675,2,path_length,,,22.0,,,,
019611,"Random trees. Random lines of fence. Some flowers, some rocks. Body of water at the bottom left.",611,pokemon_0677,2,path_length,,,24.0,,,,
019612,A forest with circular space at the top and bottom. Rocks in the middle.,612,pokemon_0678,2,path_length,,,20.0,,,,
019613,A house protected by trees next to the ocean,613,pokemon_0679,2,path_length,,,30.0,,,,
019614,"A path leading to two houses with mail boxes. A small pond, a lake at the bottom. Some trees and some fence.",614,pokemon_0680,2,path_length,,,21.0,,,,
019615,A tall house next to a path surrounded by rocks. Flowers everywhere else.,615,pokemon_0681,2,path_length,,,30.0,,,,
019616,An island with two houses.,616,pokemon_0682,2,path_length,,,8.0,,,,
019617,Trees everywhere.,617,pokemon_0683,2,path_length,,,0.0,,,,
019618,"A forest labyrinth with an entrance at the bottom right, leading to poke balls at the top left.",618,pokemon_0684,2,path_length,,,41.0,,,,
019619,A labyrinth made of trees with openings at the bottom left and top right.,619,pokemon_0685,2,path_length,,,26.0,,,,
019620,"An island in an ocean, and the island has a lake in the middle",620,pokemon_0686,2,path_length,,,8.0,,,,
019621,Rocks scattered in a field,621,pokemon_0687,2,path_length,,,0.0,,,,
019622,A long and squiggly path leading to a pokeball. Surrounded completely by rocks.,622,pokemon_0688,2,path_length,,,0.0,,,,
019623,A small fenced off house with small rocks all around it.,623,pokemon_0689,2,path_length,,,30.0,,,,
019624,A river leading to a lake with some flowers and trees scattered around.,624,pokemon_0690,2,path_length,,,30.0,,,,
019625,A completely normal lake surrounded by a forest.,625,pokemon_0691,2,path_length,,,30.0,,,,
019626,Vertical rows of trees next to vertical rows of water. And a horizontal line of rocks.,626,pokemon_0692,2,path_length,,,30.0,,,,
019627,"""EPIC SEX!"" spelled out in trees, water, rocks, and mail boxes.",627,pokemon_0693,2,path_length,,,30.0,,,,
019628,"A forest with only one opening for entrance and exit, the forest has trees all around the border with some trees, rocks, and flowers inside the forest",628,pokemon_0694,2,path_length,,,20.0,,,,
019629,"The poop emoji made out of trees, paths, and rocks.",629,pokemon_0700,2,path_length,,,16.0,,,,
019630,A small penis made out of a tree and two balls. Surrounded by a wall of rocks.,630,pokemon_0701,2,path_length,,,30.0,,,,
019631,An island that looks like a dick.,631,pokemon_0702,2,path_length,,,10.0,,,,
019632,A pickaqu in a big cave,632,pokemon_0703,2,path_length,,,30.0,,,,
019633,An emoji that is laughing and crying. The tears are water. The facial features are mail boxes. The background is road.,633,pokemon_0704,2,path_length,,,30.0,,,,
019634,A house by the beach in a forest,634,pokemon_0705,2,path_length,,,28.0,,,,
019635,"A wild field with randomly scattered path, trees, flowers, rocks, shrubs.",635,pokemon_0706,2,path_length,,,26.0,,,,
019636,A very big house. Almost an apartment complex.,636,pokemon_0707,2,path_length,,,30.0,,,,
019637,Pacman and a ghost on path background.,637,pokemon_0708,2,path_length,,,31.0,,,,
019638,A graveyard surrounded by fence. The graves are rocks.,638,pokemon_0710,2,path_length,,,33.0,,,,
019639,A planted forest accessible by road,639,pokemon_0711,2,path_length,,,15.0,,,,
019640,Nine houses in water.,640,pokemon_0712,2,path_length,,,0.0,,,,
019641,House by the lake,641,pokemon_0713,2,path_length,,,19.0,,,,
019642,"A game of chess in water. The pieces are made up of rocks, trees and mail boxes.",642,pokemon_0715,2,path_length,,,14.0,,,,
019643,Woodland clearing,643,pokemon_0716,2,path_length,,,11.0,,,,
019644,Forest Maze,644,pokemon_0717,2,path_length,,,22.0,,,,
019645,A small village with trees throughout and a path connecting houses.,645,pokemon_0718,2,path_length,,,30.0,,,,
019646,Small coastal Village,646,pokemon_0719,2,path_length,,,22.0,,,,
019647,Woodland Clearing with small pond,647,pokemon_0720,2,path_length,,,6.0,,,,
019648,House in a field with a small stream and rocks,648,pokemon_0721,2,path_length,,,31.0,,,,
019649,Forest Maze,649,pokemon_0722,2,path_length,,,25.0,,,,
019650,Marshland with lonely trees,650,pokemon_0724,2,path_length,,,23.0,,,,
019651,Forest compound,651,pokemon_0725,2,path_length,,,31.0,,,,
019652,The Swedish flag made out of water and grass. A cross of land in the middle of water.,652,pokemon_0727,2,path_length,,,17.0,,,,
019653,Isolated island with house and trees,653,pokemon_0728,2,path_length,,,9.0,,,,
019654,Nice try,654,pokemon_0729,2,path_length,,,30.0,,,,
019655,A house next to some water with a forest at the top.,655,pokemon_0730,2,path_length,,,31.0,,,,
019656,Rocky outcrop,656,pokemon_0731,2,path_length,,,30.0,,,,
019657,Open forest maze,657,pokemon_0732,2,path_length,,,28.0,,,,
019658,An island with sand and trees.,658,pokemon_0733,2,path_length,,,17.0,,,,
019659,A path with a house on one side and trees on the other.,659,pokemon_0734,2,path_length,,,25.0,,,,
019660,A body of water separating a tall house and a path to small house.,660,pokemon_0735,2,path_length,,,21.0,,,,
019661,A wide and messy path with trees to the left and a body of water to the right.,661,pokemon_0736,2,path_length,,,25.0,,,,
019662,A bridge over a river.,662,pokemon_0737,2,path_length,,,30.0,,,,
019663,A small town with six houses.,663,pokemon_0738,2,path_length,,,30.0,,,,
019664,A beach next to two large groves of trees.,664,pokemon_0739,2,path_length,,,42.0,,,,
019665,Forest with an open field.,665,pokemon_0740,2,path_length,,,24.0,,,,
019666,A small town next to water.,666,pokemon_0741,2,path_length,,,22.0,,,,
019667,"Part of a town next to a small body of water. Some trees, some rocks, a pokeball.",667,pokemon_0742,2,path_length,,,24.0,,,,
019668,Path across a small river.,668,pokemon_0743,2,path_length,,,36.0,,,,
019669,Dense forest with some shrubbery and rocks.,669,pokemon_0744,2,path_length,,,12.0,,,,
019670,A path around a pond with planted trees around.,670,pokemon_0745,2,path_length,,,27.0,,,,
019671,A tall apartment in the middle of a lake.,671,pokemon_0746,2,path_length,,,12.0,,,,
019672,Structurally planted trees next to scattered rocks.,672,pokemon_0747,2,path_length,,,37.0,,,,
019673,Many rocks with trees on the top and right border.,673,pokemon_0748,2,path_length,,,22.0,,,,
019674,A river next to a house on a field. Sand surrounding the scene to the right and bottom.,674,pokemon_0749,2,path_length,,,28.0,,,,
019675,Part of a beach.,675,pokemon_0750,2,path_length,,,32.0,,,,
019676,A fenced of road with a sign next to it.,676,pokemon_0751,2,path_length,,,26.0,,,,
019677,"A forest with some sand at the bottom, separated by fence.",677,pokemon_0752,2,path_length,,,22.0,,,,
019678,A path to a house with an inaccessible pokemon ball.,678,pokemon_0753,2,path_length,,,30.0,,,,
019679,A river with a bridge to access a house.,679,pokemon_0754,2,path_length,,,17.0,,,,
019680,Forest with some rocks.,680,pokemon_0755,2,path_length,,,12.0,,,,
019681,"A duck made out of sand, roof, and wall in front of water standing on grass.",681,pokemon_0759,2,path_length,,,18.0,,,,
019682,House in the country,682,pokemon_0761,2,path_length,,,25.0,,,,
019683,A big house with two floors.,683,pokemon_0762,2,path_length,,,33.0,,,,
019684,"A crew mate saying ""SUS"" to another crew mate. Made out of rood, water. The speech bubble is sand and signs.",684,pokemon_0764,2,path_length,,,30.0,,,,
019685,A scuffed heart made out of signs.,685,pokemon_0766,2,path_length,,,0.0,,,,
019686,A spiral of trees.,686,pokemon_0768,2,path_length,,,50.0,,,,
019687,House stacked on a house.,687,pokemon_0769,2,path_length,,,31.0,,,,
019688,A house on top of a hill on an island.,688,pokemon_0770,2,path_length,,,11.0,,,,
019689,A house by the beach,689,pokemon_0771,2,path_length,,,23.0,,,,
019690,A river in the forest,690,pokemon_0772,2,path_length,,,20.0,,,,
019691,A house in the middle of a field right next to the sea,691,pokemon_0773,2,path_length,,,26.0,,,,
019692,Four houses with a weird roof with a garden fence,692,pokemon_0774,2,path_length,,,25.0,,,,
019693,A sweedish forrest lake,693,pokemon_0775,2,path_length,,,23.0,,,,
019694,a graveyard with a flowery meadow,694,pokemon_0776,2,path_length,,,0.0,,,,
019695,a sandy road through a meadow with trees,695,pokemon_0777,2,path_length,,,30.0,,,,
019696,Two graves in a forrest,696,pokemon_0778,2,path_length,,,20.0,,,,
019697,My neighborhood,697,pokemon_0781,2,path_length,,,30.0,,,,
019698,a house in a island,698,pokemon_0782,2,path_length,,,2.0,,,,
019699,lines of trees with stones in between,699,pokemon_0783,2,path_length,,,22.0,,,,
019700,stones and trees surrounded by a line of trees,700,pokemon_0784,2,path_length,,,14.0,,,,
019701,a cabin by the lakeside,701,pokemon_0785,2,path_length,,,25.0,,,,
019702,in the pine forrest,702,pokemon_0786,2,path_length,,,20.0,,,,
019703,A cabin in a forest near the beach,703,pokemon_0787,2,path_length,,,26.0,,,,
019704,A sprawling city,704,pokemon_0788,2,path_length,,,30.0,,,,
019705,A big manor inside a forest,705,pokemon_0790,2,path_length,,,24.0,,,,
019706,"A river in the middle with one river branch going north east and another going south east, and some trees on the south east corner of the tile",706,pokemon_0791,2,path_length,,,27.0,,,,
019707,sparse forest,707,pokemon_0792,2,path_length,,,29.0,,,,
019708,town with pond,708,pokemon_0793,2,path_length,,,20.0,,,,
019709,a forest path,709,pokemon_0795,2,path_length,,,25.0,,,,
019710,A rocky maze of trees,710,pokemon_0796,2,path_length,,,22.0,,,,
019711,A fork in the road near a lake with a bridge,711,pokemon_0797,2,path_length,,,25.0,,,,
019712,Little houses in a row on a diagonal peninsula,712,pokemon_0799,2,path_length,,,30.0,,,,
019713,A rocky clearing in an ancient forest,713,pokemon_0800,2,path_length,,,29.0,,,,
019714,The edge of the woodlands,714,pokemon_0801,2,path_length,,,30.0,,,,
019715,A futuristic building on the edge of a lake.,715,pokemon_0802,2,path_length,,,25.0,,,,
019716,"A trail of flowers leading into a dense, foreboding forest.",716,pokemon_0803,2,path_length,,,24.0,,,,
019717,A maze-like path through the woods.,717,pokemon_0804,2,path_length,,,16.0,,,,
019718,A cozy home with a yard near the lake,718,pokemon_0805,2,path_length,,,30.0,,,,
019719,"A small hut with a large, unmowed lawn and two rows of fencing",719,pokemon_0806,2,path_length,,,26.0,,,,
019720,A river delta with a single building at the end of a path,720,pokemon_0807,2,path_length,,,23.0,,,,
019721,A copse with a few rocks and flowers,721,pokemon_0808,2,path_length,,,14.0,,,,
019722,A gravel path leading past the entrance to a park,722,pokemon_0809,2,path_length,,,24.0,,,,
019723,"A solitary tree stands in the center of a clearing, surrounded by flowers.",723,pokemon_0810,2,path_length,,,21.0,,,,
019724,"A house by the beach, near a forest",724,pokemon_0811,2,path_length,,,21.0,,,,
019725,A house by the river with a forest to it's left,725,pokemon_0812,2,path_length,,,25.0,,,,
019726,A forest with a square of rocks inside,726,pokemon_0813,2,path_length,,,11.0,,,,
019727,A road in a forest spilt in two by a fence,727,pokemon_0814,2,path_length,,,26.0,,,,
019728,a flowered and mushroom forest opening to two small ponds,728,pokemon_0815,2,path_length,,,30.0,,,,
019729,a yard with trees divided by rocks and a building,729,pokemon_0816,2,path_length,,,30.0,,,,
019730,shore with beach on the western side,730,pokemon_0817,2,path_length,,,32.0,,,,
019731,three houses and smaller structures on a penninsula,731,pokemon_0818,2,path_length,,,30.0,,,,
019732,a path leading out of town,732,pokemon_0819,2,path_length,,,23.0,,,,
019733,a tree maze interrupted by path blocking rocks,733,pokemon_0820,2,path_length,,,14.0,,,,
019734,a path with a branch point to a house with a pond in the back yard,734,pokemon_0821,2,path_length,,,37.0,,,,
019735,a forest with only one path through,735,pokemon_0822,2,path_length,,,20.0,,,,
019736,a forest in the process of being plowed and divided into lots,736,pokemon_0824,2,path_length,,,11.0,,,,
019737,a vineyard on the beach,737,pokemon_0825,2,path_length,,,24.0,,,,
019738,a mining operation,738,pokemon_0826,2,path_length,,,22.0,,,,
019739,a well-worned path,739,pokemon_0827,2,path_length,,,30.0,,,,
019740,a small hut in the woods with a flower yard,740,pokemon_0828,2,path_length,,,30.0,,,,
019741,edge of the forest,741,pokemon_0829,2,path_length,,,24.0,,,,
019742,forest meadows,742,pokemon_0830,2,path_length,,,12.0,,,,
019743,A house next to a small lake in a forest,743,pokemon_0832,2,path_length,,,31.0,,,,
019744,A path leading past a fence to a sign in the woods,744,pokemon_0833,2,path_length,,,21.0,,,,
019745,A maze-like forest with some rocks,745,pokemon_0834,2,path_length,,,16.0,,,,
019746,A large forest with occasional rocks,746,pokemon_0835,2,path_length,,,12.0,,,,
019747,A branching path that passes through a fence,747,pokemon_0836,2,path_length,,,31.0,,,,
019748,a house by the beach in the forest,748,pokemon_0837,2,path_length,,,25.0,,,,
019749,Hilly terrain full of trees,749,pokemon_0838,2,path_length,,,30.0,,,,
019750,An island with cerubis,750,pokemon_0839,2,path_length,,,17.0,,,,
019751,A volcano,751,pokemon_0840,2,path_length,,,21.0,,,,
019752,It’s snowing ash,752,pokemon_0841,2,path_length,,,22.0,,,,
019753,An alpine river,753,pokemon_0843,2,path_length,,,14.0,,,,
019754,An house by the lake,754,pokemon_0844,2,path_length,,,21.0,,,,
019755,"an ovary-shaped island with 4 trees on it, with grass then a beach next to the water at the bottom, and grass with a fence on it next to the water at the top",755,pokemon_0845,2,path_length,,,20.0,,,,
019756,trees occupy the lowest 70% of the image in a vertically symmetrical pattern with 3 holes; the two outside holes are smaller and the central hole is larger and contains 2 rocks in the middle bottom.,756,pokemon_0846,2,path_length,,,20.0,,,,
019757,"an island in water with a beach on the south face, going half way up the west and slightly further up the east face, while the rest of the island is covered in grass with eight trees located slightly north of centre in identical but vertically misaligned blobs",757,pokemon_0847,2,path_length,,,17.0,,,,
019758,some rocks on grass,758,pokemon_0849,2,path_length,,,0.0,,,,
019759,You in a well,759,pokemon_0850,2,path_length,,,30.0,,,,
019760,A bent road.,760,pokemon_0851,2,path_length,,,30.0,,,,
019761,A graveyard,761,pokemon_0852,2,path_length,,,30.0,,,,
019762,A fork in the road.,762,pokemon_0853,2,path_length,,,25.0,,,,
019763,A plantation.,763,pokemon_0854,2,path_length,,,30.0,,,,
019764,A copse,764,pokemon_0855,2,path_length,,,13.0,,,,
019765,An island in a large lake.,765,pokemon_0856,2,path_length,,,8.0,,,,
019766,A stone wall between fences.,766,pokemon_0857,2,path_length,,,30.0,,,,
019767,A flower patch.,767,pokemon_0859,2,path_length,,,25.0,,,,
019768,A house by the lake.,768,pokemon_0860,2,path_length,,,36.0,,,,
019769,An apartment block.,769,pokemon_0861,2,path_length,,,14.0,,,,
019770,A house in the woods.,770,pokemon_0862,2,path_length,,,15.0,,,,
019771,A woodland path.,771,pokemon_0863,2,path_length,,,30.0,,,,
019772,A hidden clearing.,772,pokemon_0864,2,path_length,,,9.0,,,,
019773,A house at the end of the road.,773,pokemon_0865,2,path_length,,,27.0,,,,
019774,A hut.,774,pokemon_0867,2,path_length,,,30.0,,,,
019775,Three clusters of trees flanking a vertical stone road,775,pokemon_0868,2,path_length,,,30.0,,,,
019776,River in the shape of an M,776,pokemon_0869,2,path_length,,,13.0,,,,
019777,10 trees that would not attack each other if they were chess queens,777,pokemon_0871,2,path_length,,,30.0,,,,
019778,crossroads cnn,778,pokemon_0872,2,path_length,,,25.0,,,,
019779,a house on the beach,779,pokemon_0873,2,path_length,,,20.0,,,,
019780,A circle of trees with grass and sand in the middle,780,pokemon_0000_rot90,2,path_length,,,8.0,,,,
019781,A island surrounded by water with a beach and some trees and flowers,781,pokemon_0001_rot90,2,path_length,,,17.0,,,,
019782,A field with some random rocks and lines of trees,782,pokemon_0002_rot90,2,path_length,,,22.0,,,,
019783,A maze of trees with some rocks blocking the path and tall grass inside,783,pokemon_0003_rot90,2,path_length,,,29.0,,,,
019784,"A path with clumps of trees on the sides, going between two lakes",784,pokemon_0004_rot90,2,path_length,,,26.0,,,,
019785,"A branching path surrounded by empty grass, with a small pond in the corner and some trees",785,pokemon_0006_rot90,2,path_length,,,24.0,,,,
019786,A big island with one tree and a big beach,786,pokemon_0007_rot90,2,path_length,,,21.0,,,,
019787,"A field with two small ponds, some trees in the corner and a tiny beach, with random pokeballs",787,pokemon_0008_rot90,2,path_length,,,30.0,,,,
019788,"A winding path going around a long straight fence, with flowers everywhere",788,pokemon_0009_rot90,2,path_length,,,37.0,,,,
019789,"A small circle of trees, with trees in the corners and the sides",789,pokemon_0010_rot90,2,path_length,,,22.0,,,,
019790,"Two big squares of trees, with flowers in one and rocks between them",790,pokemon_0011_rot90,2,path_length,,,23.0,,,,
019791,"A straight line of trees, with a straight line of rocks",791,pokemon_0012_rot90,2,path_length,,,25.0,,,,
019792,"A field with some clusters of flowers, with a beach and a tiny bit of water in the corner",792,pokemon_0013_rot90,2,path_length,,,30.0,,,,
019793,"Two blocks of trees, with a small pond and a small patch of sand",793,pokemon_0014_rot90,2,path_length,,,30.0,,,,
019794,"A path that bends, with a small pond on the side and rows of trees behind a long fence right right",794,pokemon_0016_rot90,2,path_length,,,25.0,,,,
019795,A circle of trees,795,pokemon_0017_rot90,2,path_length,,,22.0,,,,
019796,A deep forest maze,796,pokemon_0018_rot90,2,path_length,,,19.0,,,,
019797,"Island with flowers, trees, and a house in a clearing of a forest",797,pokemon_0019_rot90,2,path_length,,,18.0,,,,
019798,horizontal lines of tress separating a flower field from a lake,798,pokemon_0020_rot90,2,path_length,,,37.0,,,,
019799,A beautiful flower clearing in the middle of a deep forest,799,pokemon_0021_rot90,2,path_length,,,10.0,,,,
019800,A house sitting on the corner of a path on the edge of the sea with patches of trees around,800,pokemon_0022_rot90,2,path_length,,,25.0,,,,
019801,A spiraling forest with clumps of stones in the corner,801,pokemon_0024_rot90,2,path_length,,,27.0,,,,
019802,A tree and flower farm with a fence and tree barrier,802,pokemon_0025_rot90,2,path_length,,,29.0,,,,
019803,The edge of a forest on one side with a rock surrounded by trees in the middle,803,pokemon_0026_rot90,2,path_length,,,30.0,,,,
019804,winding walls of trees surrounding flower clearings with rocks,804,pokemon_0027_rot90,2,path_length,,,34.0,,,,
019805,walls of trees creating smaller clearings with rocks and some flowers,805,pokemon_0028_rot90,2,path_length,,,29.0,,,,
019806,A beautiful oasis in the desert with a small patch of trees and flowers,806,pokemon_0029_rot90,2,path_length,,,30.0,,,,
019807,A sparse forest with a patch of flowers in the middle and rocks on the edges,807,pokemon_0030_rot90,2,path_length,,,26.0,,,,
019808,Two rings made of trees with some rocks between them,808,pokemon_0031_rot90,2,path_length,,,20.0,,,,
019809,The edge of a forest with a clearing with a line of flowers and some rocks,809,pokemon_0032_rot90,2,path_length,,,24.0,,,,
019810,A sandy river delta with tree groups on either side if the rivers and flowers,810,pokemon_0033_rot90,2,path_length,,,20.0,,,,
019811,A town with ponds and trees,811,pokemon_0034_rot90,2,path_length,,,30.0,,,,
019812,A town with two small ponds in the corners,812,pokemon_0035_rot90,2,path_length,,,20.0,,,,
019813,"a path that makes a sharp turn by a cluster of trees, with a fence beside the path",813,pokemon_0036_rot90,2,path_length,,,30.0,,,,
