key,instruction,level_id,sample_id,reward_enum,feature_name,sub_condition,condition_0,condition_1,condition_2,condition_3,condition_4
pk003735,A fork in the road near a lake with a bridge,003735,pokemon_0797,3,hazard_count,,,,,19.0,
pk003736,Little houses in a row on a diagonal peninsula,003736,pokemon_0799,3,hazard_count,,,,,8.0,
pk003737,A rocky clearing in an ancient forest,003737,pokemon_0800,3,hazard_count,,,,,2.0,
pk003738,The edge of the woodlands,003738,pokemon_0801,3,hazard_count,,,,,0.0,
pk003739,A futuristic building on the edge of a lake.,003739,pokemon_0802,3,hazard_count,,,,,9.0,
pk003740,"A trail of flowers leading into a dense, foreboding forest.",003740,pokemon_0803,3,hazard_count,,,,,3.0,
pk003741,A maze-like path through the woods.,003741,pokemon_0804,3,hazard_count,,,,,12.0,
pk003742,A cozy home with a yard near the lake,003742,pokemon_0805,3,hazard_count,,,,,14.0,
pk003743,"A small hut with a large, unmowed lawn and two rows of fencing",003743,pokemon_0806,3,hazard_count,,,,,16.0,
pk003744,A river delta with a single building at the end of a path,003744,pokemon_0807,3,hazard_count,,,,,10.0,
pk003745,A copse with a few rocks and flowers,003745,pokemon_0808,3,hazard_count,,,,,10.0,
pk003746,A gravel path leading past the entrance to a park,003746,pokemon_0809,3,hazard_count,,,,,4.0,
pk003747,"A solitary tree stands in the center of a clearing, surrounded by flowers.",003747,pokemon_0810,3,hazard_count,,,,,9.0,
pk003748,"A house by the beach, near a forest",003748,pokemon_0811,3,hazard_count,,,,,10.0,
pk003749,A house by the river with a forest to it's left,003749,pokemon_0812,3,hazard_count,,,,,12.0,
pk003750,A forest with a square of rocks inside,003750,pokemon_0813,3,hazard_count,,,,,8.0,
pk003751,A road in a forest spilt in two by a fence,003751,pokemon_0814,3,hazard_count,,,,,7.0,
pk003752,a flowered and mushroom forest opening to two small ponds,003752,pokemon_0815,3,hazard_count,,,,,13.0,
pk003753,a yard with trees divided by rocks and a building,003753,pokemon_0816,3,hazard_count,,,,,2.0,
pk003754,shore with beach on the western side,003754,pokemon_0817,3,hazard_count,,,,,8.0,
pk003755,three houses and smaller structures on a penninsula,003755,pokemon_0818,3,hazard_count,,,,,13.0,
pk003756,a path leading out of town,003756,pokemon_0819,3,hazard_count,,,,,20.0,
pk003757,a tree maze interrupted by path blocking rocks,003757,pokemon_0820,3,hazard_count,,,,,8.0,
pk003758,a path with a branch point to a house with a pond in the back yard,003758,pokemon_0821,3,hazard_count,,,,,10.0,
pk003759,a forest with only one path through,003759,pokemon_0822,3,hazard_count,,,,,15.0,
pk003760,a forest in the process of being plowed and divided into lots,003760,pokemon_0824,3,hazard_count,,,,,0.0,
pk003761,a vineyard on the beach,003761,pokemon_0825,3,hazard_count,,,,,7.0,
pk003762,a mining operation,003762,pokemon_0826,3,hazard_count,,,,,1.0,
pk003763,a well-worned path,003763,pokemon_0827,3,hazard_count,,,,,13.0,
pk003764,a small hut in the woods with a flower yard,003764,pokemon_0828,3,hazard_count,,,,,20.0,
pk003765,edge of the forest,003765,pokemon_0829,3,hazard_count,,,,,3.0,
pk003766,forest meadows,003766,pokemon_0830,3,hazard_count,,,,,0.0,
pk003767,A house next to a small lake in a forest,003767,pokemon_0832,3,hazard_count,,,,,14.0,
pk003768,A path leading past a fence to a sign in the woods,003768,pokemon_0833,3,hazard_count,,,,,3.0,
pk003769,A maze-like forest with some rocks,003769,pokemon_0834,3,hazard_count,,,,,0.0,
pk003770,A large forest with occasional rocks,003770,pokemon_0835,3,hazard_count,,,,,15.0,
pk003771,A branching path that passes through a fence,003771,pokemon_0836,3,hazard_count,,,,,17.0,
pk003772,a house by the beach in the forest,003772,pokemon_0837,3,hazard_count,,,,,3.0,
pk003773,Hilly terrain full of trees,003773,pokemon_0838,3,hazard_count,,,,,2.0,
pk003774,An island with cerubis,003774,pokemon_0839,3,hazard_count,,,,,3.0,
pk003775,A volcano,003775,pokemon_0840,3,hazard_count,,,,,3.0,
pk003776,It’s snowing ash,003776,pokemon_0841,3,hazard_count,,,,,11.0,
pk003777,An alpine river,003777,pokemon_0843,3,hazard_count,,,,,21.0,
pk003778,An house by the lake,003778,pokemon_0844,3,hazard_count,,,,,16.0,
pk003779,"an ovary-shaped island with 4 trees on it, with grass then a beach next to the water at the bottom, and grass with a fence on it next to the water at the top",003779,pokemon_0845,3,hazard_count,,,,,19.0,
pk003780,trees occupy the lowest 70% of the image in a vertically symmetrical pattern with 3 holes; the two outside holes are smaller and the central hole is larger and contains 2 rocks in the middle bottom.,003780,pokemon_0846,3,hazard_count,,,,,3.0,
pk003781,"an island in water with a beach on the south face, going half way up the west and slightly further up the east face, while the rest of the island is covered in grass with eight trees located slightly north of centre in identical but vertically misaligned blobs",003781,pokemon_0847,3,hazard_count,,,,,3.0,
pk003782,some rocks on grass,003782,pokemon_0849,3,hazard_count,,,,,0.0,
pk003783,You in a well,003783,pokemon_0850,3,hazard_count,,,,,0.0,
pk003784,A bent road.,003784,pokemon_0851,3,hazard_count,,,,,15.0,
pk003785,A graveyard,003785,pokemon_0852,3,hazard_count,,,,,1.0,
pk003786,A fork in the road.,003786,pokemon_0853,3,hazard_count,,,,,19.0,
pk003787,A plantation.,003787,pokemon_0854,3,hazard_count,,,,,13.0,
pk003788,A copse,003788,pokemon_0855,3,hazard_count,,,,,0.0,
pk003789,An island in a large lake.,003789,pokemon_0856,3,hazard_count,,,,,1.0,
pk003790,A stone wall between fences.,003790,pokemon_0857,3,hazard_count,,,,,2.0,
pk003791,A flower patch.,003791,pokemon_0859,3,hazard_count,,,,,1.0,
pk003792,A house by the lake.,003792,pokemon_0860,3,hazard_count,,,,,2.0,
pk003793,An apartment block.,003793,pokemon_0861,3,hazard_count,,,,,16.0,
pk003794,A house in the woods.,003794,pokemon_0862,3,hazard_count,,,,,1.0,
pk003795,A woodland path.,003795,pokemon_0863,3,hazard_count,,,,,3.0,
pk003796,A hidden clearing.,003796,pokemon_0864,3,hazard_count,,,,,0.0,
pk003797,A house at the end of the road.,003797,pokemon_0865,3,hazard_count,,,,,11.0,
pk003798,A hut.,003798,pokemon_0867,3,hazard_count,,,,,23.0,
pk003799,Three clusters of trees flanking a vertical stone road,003799,pokemon_0868,3,hazard_count,,,,,15.0,
pk003800,River in the shape of an M,003800,pokemon_0869,3,hazard_count,,,,,6.0,
pk003801,10 trees that would not attack each other if they were chess queens,003801,pokemon_0871,3,hazard_count,,,,,0.0,
pk003802,crossroads cnn,003802,pokemon_0872,3,hazard_count,,,,,28.0,
pk003803,a house on the beach,003803,pokemon_0873,3,hazard_count,,,,,20.0,
pk003804,A circle of trees with grass and sand in the middle,003804,pokemon_0000_rot90,3,hazard_count,,,,,3.0,
pk003805,A island surrounded by water with a beach and some trees and flowers,003805,pokemon_0001_rot90,3,hazard_count,,,,,3.0,
pk003806,A field with some random rocks and lines of trees,003806,pokemon_0002_rot90,3,hazard_count,,,,,2.0,
pk003807,A maze of trees with some rocks blocking the path and tall grass inside,003807,pokemon_0003_rot90,3,hazard_count,,,,,20.0,
pk003808,"A path with clumps of trees on the sides, going between two lakes",003808,pokemon_0004_rot90,3,hazard_count,,,,,22.0,
pk003809,"A branching path surrounded by empty grass, with a small pond in the corner and some trees",003809,pokemon_0006_rot90,3,hazard_count,,,,,10.0,
pk003810,A big island with one tree and a big beach,003810,pokemon_0007_rot90,3,hazard_count,,,,,18.0,
pk003811,"A field with two small ponds, some trees in the corner and a tiny beach, with random pokeballs",003811,pokemon_0008_rot90,3,hazard_count,,,,,13.0,
pk003812,"A winding path going around a long straight fence, with flowers everywhere",003812,pokemon_0009_rot90,3,hazard_count,,,,,43.0,
pk003813,"A small circle of trees, with trees in the corners and the sides",003813,pokemon_0010_rot90,3,hazard_count,,,,,8.0,
pk003814,"Two big squares of trees, with flowers in one and rocks between them",003814,pokemon_0011_rot90,3,hazard_count,,,,,1.0,
pk003815,"A straight line of trees, with a straight line of rocks",003815,pokemon_0012_rot90,3,hazard_count,,,,,1.0,
pk003816,"A field with some clusters of flowers, with a beach and a tiny bit of water in the corner",003816,pokemon_0013_rot90,3,hazard_count,,,,,25.0,
pk003817,"Two blocks of trees, with a small pond and a small patch of sand",003817,pokemon_0014_rot90,3,hazard_count,,,,,4.0,
pk003818,"A path that bends, with a small pond on the side and rows of trees behind a long fence right right",003818,pokemon_0016_rot90,3,hazard_count,,,,,11.0,
pk003819,A circle of trees,003819,pokemon_0017_rot90,3,hazard_count,,,,,8.0,
pk003820,A deep forest maze,003820,pokemon_0018_rot90,3,hazard_count,,,,,1.0,
pk003821,"Island with flowers, trees, and a house in a clearing of a forest",003821,pokemon_0019_rot90,3,hazard_count,,,,,12.0,
pk003822,horizontal lines of tress separating a flower field from a lake,003822,pokemon_0020_rot90,3,hazard_count,,,,,13.0,
pk003823,A beautiful flower clearing in the middle of a deep forest,003823,pokemon_0021_rot90,3,hazard_count,,,,,12.0,
pk003824,A house sitting on the corner of a path on the edge of the sea with patches of trees around,003824,pokemon_0022_rot90,3,hazard_count,,,,,13.0,
pk003825,A spiraling forest with clumps of stones in the corner,003825,pokemon_0024_rot90,3,hazard_count,,,,,0.0,
pk003826,A tree and flower farm with a fence and tree barrier,003826,pokemon_0025_rot90,3,hazard_count,,,,,10.0,
pk003827,The edge of a forest on one side with a rock surrounded by trees in the middle,003827,pokemon_0026_rot90,3,hazard_count,,,,,0.0,
pk003828,winding walls of trees surrounding flower clearings with rocks,003828,pokemon_0027_rot90,3,hazard_count,,,,,3.0,
pk003829,walls of trees creating smaller clearings with rocks and some flowers,003829,pokemon_0028_rot90,3,hazard_count,,,,,2.0,
pk003830,A beautiful oasis in the desert with a small patch of trees and flowers,003830,pokemon_0029_rot90,3,hazard_count,,,,,41.0,
pk003831,A sparse forest with a patch of flowers in the middle and rocks on the edges,003831,pokemon_0030_rot90,3,hazard_count,,,,,6.0,
pk003832,Two rings made of trees with some rocks between them,003832,pokemon_0031_rot90,3,hazard_count,,,,,1.0,
pk003833,The edge of a forest with a clearing with a line of flowers and some rocks,003833,pokemon_0032_rot90,3,hazard_count,,,,,3.0,
pk003834,A sandy river delta with tree groups on either side if the rivers and flowers,003834,pokemon_0033_rot90,3,hazard_count,,,,,22.0,
pk003835,A town with ponds and trees,003835,pokemon_0034_rot90,3,hazard_count,,,,,23.0,
pk003836,A town with two small ponds in the corners,003836,pokemon_0035_rot90,3,hazard_count,,,,,12.0,
pk003837,"a path that makes a sharp turn by a cluster of trees, with a fence beside the path",003837,pokemon_0036_rot90,3,hazard_count,,,,,7.0,
pk003838,"A bunch of random blocks of sand, water, trees, and rocks",003838,pokemon_0037_rot90,3,hazard_count,,,,,11.0,
pk003839,"A square forest, with a spiral path of grass in the center leading to a pokeball",003839,pokemon_0038_rot90,3,hazard_count,,,,,1.0,
pk003840,"A crossroads, with some water along the path and some trees and rocks scattered randomly",003840,pokemon_0039_rot90,3,hazard_count,,,,,23.0,
pk003841,"A long river going through an empty field, with two trees and a long fence at the right",003841,pokemon_0040_rot90,3,hazard_count,,,,,3.0,
pk003842,"A small house with a path in front of it at the right, with a fence behind the house and a bunch of trees at the right, with two rivers",003842,pokemon_0041_rot90,3,hazard_count,,,,,6.0,
pk003843,A meadow surrounded by forest in a U shape,003843,pokemon_0042_rot90,3,hazard_count,,,,,0.0,
pk003844,A dense forest,003844,pokemon_0043_rot90,3,hazard_count,,,,,0.0,
pk003845,"A symmetrical forest, the trees form an arrow shape",003845,pokemon_0044_rot90,3,hazard_count,,,,,9.0,
pk003846,"A large building in front of a small forest, with two doors with a path that forks and connects the doors",003846,pokemon_0045_rot90,3,hazard_count,,,,,16.0,
pk003847,"Clusters of trees in the four corners of the map, with a cluster of trees and a rock in the center",003847,pokemon_0046_rot90,3,hazard_count,,,,,9.0,
pk003848,"Some random lines of trees, with rocks scattered between them",003848,pokemon_0047_rot90,3,hazard_count,,,,,2.0,
pk003849,"A small house with a fence in front, in front of a forest with a river in the corner",003849,pokemon_0048_rot90,3,hazard_count,,,,,16.0,
pk003850,"Some lines of trees forming a chair shape, with a cluster of rocks in the corner",003850,pokemon_0049_rot90,3,hazard_count,,,,,19.0,
pk003851,A maze of trees with some flowers and rocks,003851,pokemon_0050_rot90,3,hazard_count,,,,,2.0,
pk003852,A small cluster of rocks in the middle of an empty field beside a lake,003852,pokemon_0051_rot90,3,hazard_count,,,,,0.0,
pk003853,"A house in the corner, next to a river with a bridge across it",003853,pokemon_0052_rot90,3,hazard_count,,,,,7.0,
pk003854,A maze of trees in a square shape,003854,pokemon_0053_rot90,3,hazard_count,,,,,0.0,
pk003855,"A dense forest covering most of the map, with a small lake in the corner",003855,pokemon_0054_rot90,3,hazard_count,,,,,0.0,
pk003856,A maze of trees with big clearings,003856,pokemon_0055_rot90,3,hazard_count,,,,,0.0,
pk003857,"A river that makes a Z shape, with a long straight fence right right and empty grass everywhere else",003857,pokemon_0056_rot90,3,hazard_count,,,,,3.0,
pk003858,"A crazy branching river that splits the map into many pieces, with trees and flowers on the shore of the river",003858,pokemon_0057_rot90,3,hazard_count,,,,,15.0,
pk003859,lines of trees forming a T shape,003859,pokemon_0058_rot90,3,hazard_count,,,,,0.0,
pk003860,"A random mess of trees, sand, rocks, and grass",003860,pokemon_0060_rot90,3,hazard_count,,,,,11.0,
pk003861,"A small, thin pond in the center with a block of trees right right and some random rocks below",003861,pokemon_0061_rot90,3,hazard_count,,,,,3.0,
pk003862,"Two straight fences on the right and right, with a line of rocks connecting them and some clusters of trees",003862,pokemon_0062_rot90,3,hazard_count,,,,,2.0,
pk003863,"A castle with a moat and a sand bridge, with a fence and a gate",003863,pokemon_0063_rot90,3,hazard_count,,,,,9.0,
pk003864,"A cluster of trees in the middle of the map, with a snaking river on the side and a fence on the right",003864,pokemon_0064_rot90,3,hazard_count,,,,,6.0,
pk003865,"A straight snaking path that goes around a square pond, with some forests on the edges",003865,pokemon_0065_rot90,3,hazard_count,,,,,26.0,
pk003866,"A path with a wide block in the middle, going across a grassy field with a forest in the corner",003866,pokemon_0066_rot90,3,hazard_count,,,,,20.0,
pk003867,"A cross of trees, with a solid block of rocks in one corner and flowers in the opposite corner",003867,pokemon_0067_rot90,3,hazard_count,,,,,6.0,
pk003868,"A grassy path with fields of flowers on the sides, and lines of trees on the edge",003868,pokemon_0068_rot90,3,hazard_count,,,,,11.0,
pk003869,A bunch of trees shaped like a thick cross,003869,pokemon_0069_rot90,3,hazard_count,,,,,6.0,
pk003870,"A grassy spiral maze of trees with a prize at the end, and trees around the edges",003870,pokemon_0070_rot90,3,hazard_count,,,,,1.0,
pk003871,"A grassy forest, with two clusters of trees in the middle and trees around the edges",003871,pokemon_0071_rot90,3,hazard_count,,,,,3.0,
pk003872,Trees in the shape of a person,003872,pokemon_0073_rot90,3,hazard_count,,,,,0.0,
pk003873,"A snaking path with a square of trees in the middle of it, and some fences along the path",003873,pokemon_0074_rot90,3,hazard_count,,,,,13.0,
pk003874,"A grassy field with a small house in one corner, and small beaches in two other corners",003874,pokemon_0075_rot90,3,hazard_count,,,,,9.0,
pk003875,"A winding path going through a fence, with two big lakes in the corners and some trees",003875,pokemon_0076_rot90,3,hazard_count,,,,,20.0,
pk003876,concentric rings of trees radiating from the corner,003876,pokemon_0077_rot90,3,hazard_count,,,,,12.0,
pk003877,An empty field with some small patches of tall grass,003877,pokemon_0078_rot90,3,hazard_count,,,,,3.0,
pk003878,"two small clumps of trees in the corners, with a line of flowers running diagonally",003878,pokemon_0079_rot90,3,hazard_count,,,,,15.0,
pk003879,"trees around the border, with two large clearings separated by a line of trees",003879,pokemon_0080_rot90,3,hazard_count,,,,,3.0,
pk003880,a random clump of trees and rocks,003880,pokemon_0081_rot90,3,hazard_count,,,,,0.0,
pk003881,An empty field with red and yellow flowers and a single rock,003881,pokemon_0082_rot90,3,hazard_count,,,,,23.0,
pk003882,"A medium sized house in the corner, with a branching path running through the middle and a lake with a pokeball in the center in the corner",003882,pokemon_0083_rot90,3,hazard_count,,,,,14.0,
pk003883,"A wide path running from right to right, through lines of trees and a fence with flowers all around and a lake",003883,pokemon_0084_rot90,3,hazard_count,,,,,22.0,
pk003884,"a tiny house in the corner, with fields of tall grass separated by fences",003884,pokemon_0085_rot90,3,hazard_count,,,,,16.0,
pk003885,A big forest with a clearing that has a lake and some sand and flowers,003885,pokemon_0086_rot90,3,hazard_count,,,,,1.0,
pk003886,"A grassy field with some flowers, trees, and rocks, and a fence on the right",003886,pokemon_0087_rot90,3,hazard_count,,,,,34.0,
pk003887,"Two small houses separated by a grassy field with rocks and some signs, with two beaches in the other corners",003887,pokemon_0089_rot90,3,hazard_count,,,,,10.0,
pk003888,"A line of trees at the right, with some lines and trees and grass below",003888,pokemon_0090_rot90,3,hazard_count,,,,,10.0,
pk003889,"A small house on a lake, with a branching road going from the front door to the right",003889,pokemon_0092_rot90,3,hazard_count,,,,,10.0,
pk003890,"A randomly shaped lake across half the map, with some trees in the lake",003890,pokemon_0093_rot90,3,hazard_count,,,,,2.0,
pk003891,"A big forest that tapers off on the side, with a lake in the middle of the forest",003891,pokemon_0094_rot90,3,hazard_count,,,,,8.0,
pk003892,"A huge block of trees on the right half of the map, with a clearing below it, and one thin line of trees below that",003892,pokemon_0095_rot90,3,hazard_count,,,,,4.0,
pk003893,An amongus made of rocks,003893,pokemon_0096_rot90,3,hazard_count,,,,,1.0,
pk003894,"The right half has a grassy field with a cluster of trees, and the right half has a fence next to a straight road and some rocks below",003894,pokemon_0097_rot90,3,hazard_count,,,,,37.0,
pk003895,A grassy maze of trees,003895,pokemon_0098_rot90,3,hazard_count,,,,,19.0,
pk003896,A river curving through a grassy field with a fence on right,003896,pokemon_0099_rot90,3,hazard_count,,,,,6.0,
pk003897,A box of trees with a big cluster of trees and rocks in the middle,003897,pokemon_0101_rot90,3,hazard_count,,,,,0.0,
pk003898,"A blank field with a small square lake in the middle, next to a square of trees and a road",003898,pokemon_0102_rot90,3,hazard_count,,,,,2.0,
pk003899,A huge person made right of random blocks,003899,pokemon_0103_rot90,3,hazard_count,,,,,5.0,
pk003900,A dinosaur made out of trees,003900,pokemon_0104_rot90,3,hazard_count,,,,,1.0,
pk003901,Randomly scattered trees on a blank field,003901,pokemon_0105_rot90,3,hazard_count,,,,,0.0,
pk003902,"A wide road cutting through two fences, with a few trees and flowers on the side",003902,pokemon_0106_rot90,3,hazard_count,,,,,6.0,
pk003903,"A wide river at the right, with a straight branching road below that crosses the river",003903,pokemon_0107_rot90,3,hazard_count,,,,,19.0,
pk003904,A maze of trees with tall grass and two rocks,003904,pokemon_0108_rot90,3,hazard_count,,,,,12.0,
pk003905,A wide river separating two houses that both have roads going to the door,003905,pokemon_0109_rot90,3,hazard_count,,,,,22.0,
pk003906,"A city with three medium sized houses, and big roads connecting them",003906,pokemon_0110_rot90,3,hazard_count,,,,,17.0,
pk003907,"A square filled with tall grass, with two lines of trees and rocks on the right and right",003907,pokemon_0111_rot90,3,hazard_count,,,,,5.0,
pk003908,A circular river around an island that is covered in trees and rocks,003908,pokemon_0112_rot90,3,hazard_count,,,,,21.0,
pk003909,"A circular crossroads with trees in the middle, with branches going in every direction",003909,pokemon_0113_rot90,3,hazard_count,,,,,13.0,
pk003910,town on the beach by the sea,003910,pokemon_0114_rot90,3,hazard_count,,,,,31.0,
pk003911,a field with a fence cutting it in half with a hole in the middle of the fence with trees on either side of the hole above the fence,003911,pokemon_0115_rot90,3,hazard_count,,,,,0.0,
pk003912,trees in the corner with some flowers and rock spread throughout,003912,pokemon_0116_rot90,3,hazard_count,,,,,2.0,
pk003913,a large forest covering most of the area with a single tree misplaced to the right of the screen,003913,pokemon_0117_rot90,3,hazard_count,,,,,0.0,
pk003914,"a symmetric forest creating 4 clearings, each with a pair of trees and a rock",003914,pokemon_0118_rot90,3,hazard_count,,,,,3.0,
pk003915,a path beset by pairs of trees with flower fields on the outside leading to a river with a bridge,003915,pokemon_0119_rot90,3,hazard_count,,,,,14.0,
pk003916,a sandy path leading to a beach by the sea with trees and flowers on the side of the path,003916,pokemon_0120_rot90,3,hazard_count,,,,,26.0,
pk003917,a heart made of houses,003917,pokemon_0121_rot90,3,hazard_count,,,,,0.0,
pk003918,a field of rocks with some flowers in the middle with lines of trees on the right and right with a river on the side,003918,pokemon_0122_rot90,3,hazard_count,,,,,1.0,
pk003919,a field with a line of grass through the middle with rocks placed on the right and trees with flowers on the right,003919,pokemon_0123_rot90,3,hazard_count,,,,,6.0,
pk003920,a grid of trees covering the right half of the area with two rocks placed randomly in that grid,003920,pokemon_0124_rot90,3,hazard_count,,,,,0.0,
pk003921,A branching path around a field with a lake with beautiful scenery and a house on the right,003921,pokemon_0125_rot90,3,hazard_count,,,,,20.0,
pk003922,signs in the shape of letters and numbers on a green field,003922,pokemon_0126_rot90,3,hazard_count,,,,,0.0,
pk003923,line of trees with a notch in the middle with rocks below and flowers,003923,pokemon_0127_rot90,3,hazard_count,,,,,6.0,
pk003924,a square forest with lines of trees coming out of it,003924,pokemon_0128_rot90,3,hazard_count,,,,,0.0,
pk003925,"Two circles of trees on a beach by the ocean, with a row of rocks and flowers behind a fence",003925,pokemon_0129_rot90,3,hazard_count,,,,,14.0,
pk003926,Trees randomly scattered on a empty field,003926,pokemon_0130_rot90,3,hazard_count,,,,,0.0,
pk003927,"A small house on a grassy island with trees, surrounded by water",003927,pokemon_0131_rot90,3,hazard_count,,,,,1.0,
pk003928,perfect diagonal lines of trees,003928,pokemon_0132_rot90,3,hazard_count,,,,,13.0,
pk003929,A wide line of trees above a grassy clearing with flowers,003929,pokemon_0133_rot90,3,hazard_count,,,,,7.0,
pk003930,"A graveyard surrounded by fences on the right and right, next to an overgrown forest",003930,pokemon_0134_rot90,3,hazard_count,,,,,18.0,
pk003931,"A empty square grassy clearing, surrounded by a line of trees",003931,pokemon_0135_rot90,3,hazard_count,,,,,1.0,
pk003932,"A grassy unkept town with four houses, with a road leading to each house",003932,pokemon_0136_rot90,3,hazard_count,,,,,32.0,
pk003933,"A maze of trees with two openings, and some rocks in the clearings",003933,pokemon_0137_rot90,3,hazard_count,,,,,5.0,
pk003934,"A rectangle of trees, above the word ""HI"" made out of flowers",003934,pokemon_0138_rot90,3,hazard_count,,,,,3.0,
pk003935,"A wide road going around a pond surrounded by flowers, above a wide line of trees",003935,pokemon_0139_rot90,3,hazard_count,,,,,12.0,
pk003936,A gigantic upside-left house,003936,pokemon_0140_rot90,3,hazard_count,,,,,0.0,
pk003937,Straight lines of trees with grassy roads going between them,003937,pokemon_0141_rot90,3,hazard_count,,,,,22.0,
pk003938,"A road that takes a sharp turn with trees along it, below the ocean",003938,pokemon_0142_rot90,3,hazard_count,,,,,3.0,
pk003939,"A neat town with many houses, each house has a tree next to it and a road through the town",003939,pokemon_0143_rot90,3,hazard_count,,,,,11.0,
pk003940,A wide path through the forest that has a sharp turn,003940,pokemon_0144_rot90,3,hazard_count,,,,,3.0,
pk003941,A plain path going through a field with some flowers and one cluster of trees,003941,pokemon_0145_rot90,3,hazard_count,,,,,13.0,
pk003942,"A big pool with a fence on one side, and trees on the corners",003942,pokemon_0146_rot90,3,hazard_count,,,,,6.0,
pk003943,"A big crazy house in the middle of a scary forest, with a path leading to the front door",003943,pokemon_0147_rot90,3,hazard_count,,,,,16.0,
pk003944,"A sandy island in the middle of the ocean, with a small house on it",003944,pokemon_0148_rot90,3,hazard_count,,,,,10.0,
pk003945,A maze of trees with some rocks and flowers,003945,pokemon_0149_rot90,3,hazard_count,,,,,2.0,
pk003946,An empty clearing blow a dense forest with a path blocked by a rock,003946,pokemon_0150_rot90,3,hazard_count,,,,,5.0,
pk003947,a small L shaped pond surrounded a flowery forest,003947,pokemon_0151_rot90,3,hazard_count,,,,,11.0,
pk003948,an S shaped maze of trees,003948,pokemon_0152_rot90,3,hazard_count,,,,,2.0,
pk003949,"an X shaped river with a tree island, a sand island, a rock island, and a tree island",003949,pokemon_0153_rot90,3,hazard_count,,,,,8.0,
pk003950,A tree maze with rocks with an entrance at the right and an exit on right,003950,pokemon_0154_rot90,3,hazard_count,,,,,0.0,
